,video_id,channel_title,channel_id,video_publish_date,video_title,video_description,video_category,video_thumbnail,collection_date
0,aAnRWW8lJX0,Profanity1488,UC3Eg0dfRkxDO5akVmlUTB_g,2008-04-02 23:08:41.000000,The Genocide Of The White People,You Must See That !!It's Important if you're White!,,https://i.ytimg.com/vi/aAnRWW8lJX0/hqdefault.jpg,2019-02-28 14:39:50.016586
1,XxKZDv5kGWM,whitemenrights,UCeMYyqb3-1Ro_kavPHHNHmA,2008-06-26 02:59:51.000000,white men genocide/the line,"FACT OR FICTION.. Just to discrimantion to the top white men for white woman can be a genocide, the whitesby mix up. Fact issue. 1.why the red neck(american ...",,https://i.ytimg.com/vi/XxKZDv5kGWM/hqdefault.jpg,2019-02-28 14:39:50.788761
2,ksyH-dZC-is,mehdiforworldjustice,UCC3-tdJ9IsJXh5d6cPCjVOw,2008-09-08 19:36:56.000000,Islam Wants To Fund White Farmer Genocide In South Africa,this is not a rehearsal.,,https://i.ytimg.com/vi/ksyH-dZC-is/hqdefault.jpg,2019-02-28 14:39:51.800563
3,LJt1z78wG9w,Knowledge for LIFE (Know4LIFE),UCwamIJyMvB-eYIetQmV1yxQ,2009-01-20 09:26:44.000000,White Societies Rationalization of Black Genocide - ABC&#39;s of Oppression and Genocide 3,"The late, great Prof. Amos Wilson explain, in a lecture entitled: The ABC's of Oppression and Genocide, how white America will not address the real problems ...",,https://i.ytimg.com/vi/LJt1z78wG9w/hqdefault.jpg,2019-02-28 14:39:53.124945
4,dKA8-_wPiZI,ACuploads3,UCM-q7QctuABk4znui2IgJxg,2009-03-15 09:35:10.000000,White South African Genocide,http://www.youtube.com/user/AryanCrusaderXII.,,https://i.ytimg.com/vi/dKA8-_wPiZI/hqdefault.jpg,2019-02-28 14:39:53.926850
5,AHyxWcNOWN8,Contrav眼 TV,UCVesZzYBq86RSQ41MJUziDA,2009-04-01 15:09:31.000000,La Chorrera: White Gold Genocide (part II),"Las c炅aras de CONTRAV페 viajaron a la olvidada poblaci蚤 de La Chorrera, ubicada en medio de la selva amaz蚤ica al sur del pa押. Hace m硬 de 80 a絪s, ...",,https://i.ytimg.com/vi/AHyxWcNOWN8/hqdefault.jpg,2019-02-28 14:39:54.534770
6,xvEhHFkVpiM,Contrav眼 TV,UCVesZzYBq86RSQ41MJUziDA,2009-04-01 14:46:30.000000,La Chorrera: White Gold Genocide (part I),The history of the idigenas in the Amazon. amazon native documentary.,,https://i.ytimg.com/vi/xvEhHFkVpiM/hqdefault.jpg,2019-02-28 14:39:54.534770
7,X4nDzQhcYv4,Contrav眼 TV,UCVesZzYBq86RSQ41MJUziDA,2009-04-01 15:53:04.000000,La Chorrera: White Gold Genocide (part  III) //CONTRAVIA// eng.subtl.,"Las c炅aras de CONTRAV페 viajaron a la olvidada poblaci蚤 de La Chorrera, ubicada en medio de la selva amaz蚤ica al sur del pa押. Hace m硬 de 80 a絪s, ...",,https://i.ytimg.com/vi/X4nDzQhcYv4/hqdefault.jpg,2019-02-28 14:39:54.534770
8,ZB33ROD88-M,Contrav眼 TV,UCVesZzYBq86RSQ41MJUziDA,2009-04-01 16:32:44.000000,La Chorrera: White Gold Genocide (part IV) //CONTRAV페// eng. subtl,"Las c炅aras de CONTRAV페 viajaron a la olvidada poblaci蚤 de La Chorrera, ubicada en medio de la selva amaz蚤ica al sur del pa押. Hace m硬 de 80 a絪s, ...",,https://i.ytimg.com/vi/ZB33ROD88-M/hqdefault.jpg,2019-02-28 14:39:54.534770
9,GwG5Oo-GUyI,Contrav眼 TV,UCVesZzYBq86RSQ41MJUziDA,2009-04-01 17:40:05.000000,La Chorrera: White Gold Genocide (part V),"Las c炅aras de CONTRAV페 viajaron a la olvidada poblaci蚤 de La Chorrera, ubicada en medio de la selva amaz蚤ica al sur del pa押. Hace m硬 de 80 a絪s, ...",,https://i.ytimg.com/vi/GwG5Oo-GUyI/hqdefault.jpg,2019-02-28 14:39:54.534770
10,KG0I4xpaPBI,Contrav眼 TV,UCVesZzYBq86RSQ41MJUziDA,2009-04-01 19:29:31.000000,La Chorrera: White Gold Genocide (part VI),"Las c炅aras de CONTRAV페 viajaron a la olvidada poblaci蚤 de La Chorrera, ubicada en medio de la selva amaz蚤ica al sur del pa押. Hace m硬 de 80 a絪s, ...",,https://i.ytimg.com/vi/KG0I4xpaPBI/hqdefault.jpg,2019-02-28 14:39:54.534770
11,TtoaLuyruKc,tamilmahan,UC5CH-NvC_rRI-J7OyvHGMaA,2009-06-10 05:15:01.000000,Thirumavalavan demands white paper on genocide of Tamils,"Thirumavalavan demands white paper on genocide of Tamils [TamilNet, Tuesday, 09 June 2009, 16:06 GMT] ...",,https://i.ytimg.com/vi/TtoaLuyruKc/hqdefault.jpg,2019-02-28 14:39:55.369444
12,i1nkukpPvDE,rayleno222,UCAB_04BngGPtzaPGzwVEMMA,2009-06-02 15:29:14.000000,GENOCIDE: THIRUMAVALAVAN MP CONDEMNS THE UNPRECEDENTED KILLING OF WHITE FLAG BEARERS,THIRUMAVALAVAN MP CONDEMNS THE UNPRECEDENTED KILLING OF WHITE FLAG BEARERS P NADESAN AND PULIDEVAN. HE ALSO CONDEMNS ...,,https://i.ytimg.com/vi/i1nkukpPvDE/hqdefault.jpg,2019-02-28 14:39:55.369444
13,6sBBtyEZokk,MrDoobyscooby,UCIv73aDoXJEZaNVIYPrlp-Q,2009-09-02 08:33:45.000000,Communist planned Genocide of Whites in South Africa,"Weve been lied to Nelson Mandela is a Communist murderer. Operation Uhuru, Vula, Night of the long knives Iron Eagle the plan has many names.",,https://i.ytimg.com/vi/6sBBtyEZokk/hqdefault.jpg,2019-02-28 14:39:56.470557
14,p0BzMP8sx7o,Mullikin's,UCul3unCHEZf3ccWpHDjJKHg,2009-09-02 00:12:14.000000,Genocide/ Garry white Super Summer Showdown Hype,The events leading up to EWE's Super Summer Showdown.,,https://i.ytimg.com/vi/p0BzMP8sx7o/hqdefault.jpg,2019-02-28 14:39:56.470557
15,E_mXzTaMB3g,balancex3,UCLu8KLCNZbH9kIoZINEpHLA,2009-10-07 09:52:07.000000,2012 Enlightenment Will Lead to Genocide Chris White 1/3,nwo= newage world order = 2012.,,https://i.ytimg.com/vi/E_mXzTaMB3g/hqdefault.jpg,2019-02-28 14:39:57.020376
16,uIXPoIVmWUg,balancex3,UCLu8KLCNZbH9kIoZINEpHLA,2009-10-07 10:09:35.000000,2012 Enlightenment Will Lead to Genocide Chris White 3/3,new world order = newage world order = 2012.,,https://i.ytimg.com/vi/uIXPoIVmWUg/hqdefault.jpg,2019-02-28 14:39:57.020376
17,ktRr2GcRZ-Y,RareComplex72,UCaNh93YacVsWob1CGH6Esnw,2009-10-08 19:33:49.000000,2012 &quot;The Year of Enlightenment&quot; Will Lead To Genocide (Chris White) Part 1/3,2012 Is known as the year of enlightenment to many new age believers and philosophers. This video has been reuploaded from KeithTruth.,,https://i.ytimg.com/vi/ktRr2GcRZ-Y/hqdefault.jpg,2019-02-28 14:39:57.020376
18,GFYyDD-XA4Y,RareComplex72,UCaNh93YacVsWob1CGH6Esnw,2009-10-08 19:51:43.000000,2012 &quot;The Year of Enlightenment&quot; Will Lead To Genocide (Chris White) Part 2/3,2012 Is known as the year of enlightenment to many new age believers and philosophers. This video has been reuploaded from KeithTruth.,,https://i.ytimg.com/vi/GFYyDD-XA4Y/hqdefault.jpg,2019-02-28 14:39:57.020376
19,-Yjmtr_tSBE,Nidder1,UCShN6L0GU25cHaAlrgWbZMw,2009-10-09 00:22:50.000000,2012 Enlightenment Will Lead to Genocide Chris White 3/3,The 2012 lie 3 of 3.,,https://i.ytimg.com/vi/-Yjmtr_tSBE/hqdefault.jpg,2019-02-28 14:39:57.020376
20,X4OLThL5rXw,Arzive,UCEVK0MNVri6Kf_0js9iDyjg,2010-01-15 06:16:26.000000,The White Genocide 1: ACCORDING TO GENOCIDE SCHOLARS,"The Armenian Genocide isn't a story of the past. It happens still today. This series aims at showing how Armenians are facing this threat to this day, and how ...",,https://i.ytimg.com/vi/X4OLThL5rXw/hqdefault.jpg,2019-02-28 14:39:58.273120
21,nM4thZBKMWY,Arzive,UCEVK0MNVri6Kf_0js9iDyjg,2010-01-18 20:36:41.000000,The White Genocide 2: DISTORTION OF HISTORY,"The Armenian Genocide isn't a story of the past. It happens still today. This series aims at showing how Armenians are facing this threat to this day, and how ...",,https://i.ytimg.com/vi/nM4thZBKMWY/hqdefault.jpg,2019-02-28 14:39:58.273120
22,kT4SLj5l3f0,David Duke,UCNpAwV6GlFst1x3jmqCgYbQ,2010-04-29 18:35:42.000000,White Genocide in South Africa,www.http://www.davidduke.com DON'T LET MY VIDEOS BE CENSORED! Due to organized efforts to stifle free speech and ban my videos -- YouTube ...,,https://i.ytimg.com/vi/kT4SLj5l3f0/hqdefault.jpg,2019-02-28 14:39:59.249811
23,mfnQgA0m1BU,dolliefront1,UC8t_0rgL4I6euQq-u3TEbDw,2010-04-30 12:14:07.000000,White Genocide in South Africa Hypocrisy By DrDDuke Not Suing Czech Rep. For Human Rights,Duke Blocked ME From making this a Comment !!! NOW I AM T-DEFENDED !!!,,https://i.ytimg.com/vi/mfnQgA0m1BU/hqdefault.jpg,2019-02-28 14:39:59.249811
24,0It6F1bEvwc,dolliefront1,UC8t_0rgL4I6euQq-u3TEbDw,2010-04-30 16:22:30.000000,White Genocide SA Hypocrisy By DrDDuke Not Suing Czech Rep For Human Rights v. Hosea 2:16 DOLLY,T-DEFENDED !!! Duke Blocked ME from Commenting Directly at his Video !!! This is an IMPROVEMENT of prior similar video with extra photo and clearer text ...,,https://i.ytimg.com/vi/0It6F1bEvwc/hqdefault.jpg,2019-02-28 14:39:59.249811
25,hu3UiXXCAz4,CaliforniaNSM,UCYkXmyxLCQHqMY2msjM7K4Q,2010-05-25 03:55:01.000000,White Genocide -full version,Full version of the previous video on the Boer Genocide.,,https://i.ytimg.com/vi/hu3UiXXCAz4/hqdefault.jpg,2019-02-28 14:39:59.805839
26,Gc-7hecOiYQ,CaliforniaNSM,UCYkXmyxLCQHqMY2msjM7K4Q,2010-05-20 02:14:56.000000,Protest Against White GENOCIDE,"15th of May 2010, NSM Britannia joined a protest against the systematic ethnic cleansing of the Boer people! In disgust at the ANC government and the ...",,https://i.ytimg.com/vi/Gc-7hecOiYQ/hqdefault.jpg,2019-02-28 14:39:59.806854
27,RIdKtOsoEgM,jtredoux,UCEuymFVFMOpB-K8FbqBAdAA,2010-06-08 19:48:23.000000,White South African genocide,"Why do we never hear about this? Why have a million white Africans, who has lived there for hundreds of year, fled South Africa? Why do you find thousands of ...",,https://i.ytimg.com/vi/RIdKtOsoEgM/hqdefault.jpg,2019-02-28 14:40:00.422392
28,rMm3iSSpcF0,CornfieldCntyGazette,UCdzd-By1DMzrFf-fmJl3RiA,2010-06-27 01:32:29.000000,White GeNOcide #2,"I produced this song and video from pictures, stories, and news reports from Boer.",,https://i.ytimg.com/vi/rMm3iSSpcF0/hqdefault.jpg,2019-02-28 14:40:00.422392
29,ijJHD_XqdYI,earlturner2,UC98oqhwRh1lJwQLjFG_TkLQ,2010-06-02 03:23:11.000000,The Genocide Of The White People.mp4,The White race is being eradicated throughout the Western world and the media ignores it.,,https://i.ytimg.com/vi/ijJHD_XqdYI/hqdefault.jpg,2019-02-28 14:40:00.422392
30,MdZn3ggbXUQ,greenfieldcc,UC-rYOFJ23fmzgpD0u-Jh-uQ,2010-07-26 18:58:19.000000,Rise of the Nazis and Evolution to Genocide pt2 - Thomas M. White,"Thomas M. White, Coordinator of Ed. Outreach for Cohen Center for Holocaust Studies at Keene State, in his presentation-lecture focuses on the origins and rise ...",,https://i.ytimg.com/vi/MdZn3ggbXUQ/hqdefault.jpg,2019-02-28 14:40:01.045335
31,mrnnx9DCDF4,David Duke,UCMnn8opxwA5DVXgBSwBvilQ,2010-11-20 22:00:32.000000,White Genocide in South Africa,White Genocide in South Africa. http://www.davidduke.com/,,https://i.ytimg.com/vi/mrnnx9DCDF4/hqdefault.jpg,2019-02-28 14:40:02.391790
32,Jmf7M49Vzpc,DrDukesDeletedVids2,UC13S4DXJ-3k_WbxnpF5Fh9w,2010-12-31 08:37:39.000000,White Genocide in South Africa,"This video shows how White people are facing an ongoing genocide in South Africa, and the vital need for people all over the world to raise their voice to stop ...",,https://i.ytimg.com/vi/Jmf7M49Vzpc/hqdefault.jpg,2019-02-28 14:40:02.966779
33,ggXQ7Rf7mec,PaulSuicide,UCgOs99K83YnMR_deSOfijNQ,2010-12-11 00:52:34.000000,White Genocide Solution,"A message, to white people :)",,https://i.ytimg.com/vi/ggXQ7Rf7mec/hqdefault.jpg,2019-02-28 14:40:02.966779
34,BGQ52XqVu48,howru0056,UCZRAPnxkCvl8gM4EeqbwEkw,2010-12-23 02:00:52.000000,The Genocide Of White People,,,https://i.ytimg.com/vi/BGQ52XqVu48/hqdefault.jpg,2019-02-28 14:40:02.966779
35,o1CjC_7qulE,howru0056,UCZRAPnxkCvl8gM4EeqbwEkw,2010-12-23 03:20:31.000000,World Wide White Genocide,,,https://i.ytimg.com/vi/o1CjC_7qulE/hqdefault.jpg,2019-02-28 14:40:02.966779
36,cDk_OEq8PW4,InternationalRabbit,UCem9Wc4qt4Hw7_rdBb7Mcbg,2011-01-28 06:47:22.000000,Is White Genocide Real?,http://www.hrweb.org/legal/genocide.html UN Resolution on Genocide Adopted by Resolution 260 (III) A of the United Nations General Assembly on 9 ...,,https://i.ytimg.com/vi/cDk_OEq8PW4/hqdefault.jpg,2019-02-28 14:40:03.566884
37,kQw7alhlz7E,InternationalRabbit,UCem9Wc4qt4Hw7_rdBb7Mcbg,2011-01-28 14:46:50.000000,What is the Definition of Genocide?,Are you pro White? Or pro White genocide? http://www.whiterabbitradio.net.,,https://i.ytimg.com/vi/kQw7alhlz7E/hqdefault.jpg,2019-02-28 14:40:03.567890
38,BKlaetiZMUo,WHITERABBITRADIO3,UCZ6eAo3qPcevhkHb1YkI5tg,2011-01-17 18:19:48.000000,AFRICA FOR AFRICANS; ASIA FOR ASIANS; WHITE COUNTRIES FOR EVERYBODY.,"Africa for the Africans; Asia for the Asians, White countries for everybody. No one is flooding African countries with millions of non-Africans, and giving them ...",,https://i.ytimg.com/vi/BKlaetiZMUo/hqdefault.jpg,2019-02-28 14:40:03.567890
39,hIFiaGvXjec,topgamelord,UC45FCwnD3jSZ0G5jelyol3w,2011-01-18 04:35:44.000000,Stop-Genocide (White Man&#39;s  time is limited),"relevant site http://news-fact.blogspot.com/ Now, when someone ups this type of video, others will try to claim that I'm a fascist, racist, I'm a supremacist. It's funny ...",,https://i.ytimg.com/vi/hIFiaGvXjec/hqdefault.jpg,2019-02-28 14:40:03.567890
40,c2R38jj8b7g,nrdvnd,UCUUHYHiyuEMELCTvbMEbPfA,2011-01-02 19:34:32.000000,Stop White Genocide in SA,Tel-Aviv 02.01.11.,,https://i.ytimg.com/vi/c2R38jj8b7g/hqdefault.jpg,2019-02-28 14:40:03.567890
41,Q8LaSfTXdDI,JewishCrimeNetwork02,UCUSwd8n0tYC0aGA7Bfau1tQ,2011-01-16 02:14:20.000000,Larry and Sarah Discuss White Genocide,"Keywords: American Militia, American Resistance Movement, American Revolution, Revolution, Revolt, American Militia Movement, A.R.M, Alex Jones, New ...",,https://i.ytimg.com/vi/Q8LaSfTXdDI/hqdefault.jpg,2019-02-28 14:40:03.567890
42,TT9MOYTvmEg,topgamelord,UC45FCwnD3jSZ0G5jelyol3w,2011-01-20 17:57:58.000000,The Final Solution :  Genocide of White People,"new site http://thegamelord.net/ site- http://news-fact.blogspot.com/ This clip recites the genocidal words spoken by Tim Wise, against White People after the ...",,https://i.ytimg.com/vi/TT9MOYTvmEg/hqdefault.jpg,2019-02-28 14:40:03.567890
43,ALvugs7Sv_0,John Genocide,UCzbhAeIqOulIDW6Pob1Cv3Q,2011-01-22 22:16:11.000000,Fight White Genocide!,Everybody says there is this RACE problem. Everybody says this RACE problem will be solved when the third world pours into EVERY white country and ONLY ...,,https://i.ytimg.com/vi/ALvugs7Sv_0/hqdefault.jpg,2019-02-28 14:40:03.567890
44,zmXdvg2NxFI,Freespeechknight,UCseD0CajWbSXYU9dm6Ovr1w,2011-01-19 14:16:38.000000,White genocide in south africa,http://www.davidduke.com/ Please subscribe to news and updates att davidduke.com.,,https://i.ytimg.com/vi/zmXdvg2NxFI/hqdefault.jpg,2019-02-28 14:40:03.567890
45,H2vhpyDPQ2w,SuperIceland,UChn4cl74bCs6YsDjJ0-F57w,2011-01-09 02:44:15.000000,White+Genocide+Across+The+Globe+(The+Mantra).flv,Mantra.,,https://i.ytimg.com/vi/H2vhpyDPQ2w/hqdefault.jpg,2019-02-28 14:40:03.567890
46,O7E1b4sbu0k,WILLTOPOWER144,UCDp8_C3CRDDk9B5jf7Pkqbw,2011-01-17 12:14:16.000000,WHITE TRAITOR POLITICIANS SILENT ABOUT WHITE GENOCIDE. GENOCIDE TRIALS ARE COMING!,"Africa for the Africans; Asia for the Asians, White countries for everybody. No one is flooding African countries with millions of non-Africans, and giving them ...",,https://i.ytimg.com/vi/O7E1b4sbu0k/hqdefault.jpg,2019-02-28 14:40:03.567890
47,Xa46pfjqOZQ,WHITERABBITRADIO8,UC92T_TQkpSH-myQt2i8C4OQ,2011-01-21 14:12:50.000000,Jew inspired race war...it&#39;s here. It&#39;s White GENOCIDE. White politicians silent!,"Africa for the Africans; Asia for the Asians, White countries for everybody. No one is flooding African countries with millions of non-Africans, and giving them ...",,https://i.ytimg.com/vi/Xa46pfjqOZQ/hqdefault.jpg,2019-02-28 14:40:03.567890
48,QZIGOKZzEcM,freedomanddemocracy1,UCbW1I2jkAKmP2atBgrMCJSg,2011-01-03 14:07:42.000000,White Genocide in South Africa,by Dr. David Duke http://www.archive.org/details/MyAwakeningAPathToRacialUnderstanding.,,https://i.ytimg.com/vi/QZIGOKZzEcM/hqdefault.jpg,2019-02-28 14:40:03.567890
49,yuNhkdGXMbg,Sissy Wright,UCQL173cfuHm7P3b-Xc1ReJg,2011-01-17 06:17:45.000000,South Africa&#39;s White Genocide.flv,,,https://i.ytimg.com/vi/yuNhkdGXMbg/hqdefault.jpg,2019-02-28 14:40:03.567890
50,OA9y_6EzOOk,WHITERABBITRADIO7,UCx-1NY2rqo_dnEYSZZm2r9A,2011-01-20 17:04:25.000000,Jew inspired race war...it&#39;s here. It&#39;s GENOCIDE. White politicians silent.,"Africa for the Africans; Asia for the Asians, White countries for everybody. No one is flooding African countries with millions of non-Africans, and giving them ...",,https://i.ytimg.com/vi/OA9y_6EzOOk/hqdefault.jpg,2019-02-28 14:40:03.567890
51,X64ad-fv1NA,ChittyBang333,UC3zXXwTQJI9oyj3bQD4g9Kg,2011-01-30 16:08:50.000000,Genocide has to be violent.,"The Mantra in Action: Questions and Answers ARGUMENTS Anti-white: Genocide has to be violent. Pro-white: Wholly incorrect, at which point it under ...",,https://i.ytimg.com/vi/X64ad-fv1NA/hqdefault.jpg,2019-02-28 14:40:03.567890
52,Hc6TELMw-CI,SuperisIceland,UCEvFJ2Wkk3JG9X3v5aQr3zw,2011-01-19 02:05:47.000000,White+Genocide+Across+The+Globe+The+Mantra,,,https://i.ytimg.com/vi/Hc6TELMw-CI/hqdefault.jpg,2019-02-28 14:40:03.567890
53,u7eHxOhyNV8,SaveRabbits,UCMnxMJ7P4GOb36jfrhqQKgw,2011-02-06 14:48:12.000000,Tim Wise on White Genocide,,,https://i.ytimg.com/vi/u7eHxOhyNV8/hqdefault.jpg,2019-02-28 14:40:04.209242
54,FIRm4s3SsSk,InternationalRabbit,UCem9Wc4qt4Hw7_rdBb7Mcbg,2011-02-10 01:35:19.000000,Alex Jones on Anti White Behavior and Targeting of Whites,An interesting segment from Alex Jones on Anti-White behavior and the targeting of Whites. Learn to play practical politics. www.whiterabbitradio.net.,,https://i.ytimg.com/vi/FIRm4s3SsSk/hqdefault.jpg,2019-02-28 14:40:04.209242
55,XNA3YMmC9zM,Joniversity,UC-WLRFvVmIQ_r-WTnbuKmQA,2011-02-28 00:48:23.000000,Racism - The White Race Is Facing Extinction?,Regarding shout-outs: UntemperedSteel: www.youtube.com/user/untemperedsteel SmilingSkeptic: www.youtube.com/user/SmilingSkeptic ArteTuga: ArteTuga2 ...,,https://i.ytimg.com/vi/XNA3YMmC9zM/hqdefault.jpg,2019-02-28 14:40:04.209242
56,uUm0Audg0m8,InternationalRabbit,UCem9Wc4qt4Hw7_rdBb7Mcbg,2011-02-10 00:18:40.000000,Are You Pro White or Pro White Genocide?,Everybody says there is this RACE problem. Everybody says this RACE problem will be solved when the third world pours into EVERY white country and ONLY ...,,https://i.ytimg.com/vi/uUm0Audg0m8/hqdefault.jpg,2019-02-28 14:40:04.209242
57,f4m8pPFqpIo,Paul L. Muckle,UClxqyHy9ykpdsm4CNx6maCg,2011-02-18 09:49:39.000000,NIBIRU &amp; BLACK/ WHITE  HISTORY.ROTHSCHILD RESPONSIBLE FOR SLAVERY &amp; GENOCIDE IN AFRICA &amp; HAITI,"The more the devil fights me, the more I will put out the TRUTH against him. ""COMING BACK AT THEM, LIKE 100,0000 POUNDS OF LEAD""!",,https://i.ytimg.com/vi/f4m8pPFqpIo/hqdefault.jpg,2019-02-28 14:40:04.209242
58,ry07KVbOQH8,SaveRabbits,UCMnxMJ7P4GOb36jfrhqQKgw,2011-02-26 01:14:26.000000,The Today Show - White Genocide,Isn't it odd how this multiculturalism and blended humanity is promoted in each and every White country on the planet? Yet it is not promoted in places like Africa ...,,https://i.ytimg.com/vi/ry07KVbOQH8/hqdefault.jpg,2019-02-28 14:40:04.209242
59,ZbxGCq_0Q8M,ChittyBang333,UC3zXXwTQJI9oyj3bQD4g9Kg,2011-02-04 14:20:39.000000,"What anti-racists (a code word for anti-white),? always say to pro whites",The Mantra in Action: Questions and Answers ARGUMENTS Anti-White: You are a horrible human being. You obviously have a severely skewed view of the ...,,https://i.ytimg.com/vi/ZbxGCq_0Q8M/hqdefault.jpg,2019-02-28 14:40:04.209242
60,D3K2wP5mmB0,SaveRabbits,UCMnxMJ7P4GOb36jfrhqQKgw,2011-02-21 06:30:06.000000,Fighting White Genocide Graphics,http://s1183.photobucket.com/albums/x473/fightwhitegenocide/ http://www.zshare.net/download/867479368c829511/ http://memegenerator.net/,,https://i.ytimg.com/vi/D3K2wP5mmB0/hqdefault.jpg,2019-02-28 14:40:04.209242
61,m6PUyW9VmMs,panzerdealer,UCVwBA7NJqKsEKg3bgwg94QQ,2011-02-27 08:05:36.000000,Is White Genocide Real ?,Is White Genocide Real ?,,https://i.ytimg.com/vi/m6PUyW9VmMs/hqdefault.jpg,2019-02-28 14:40:04.209242
62,vg1gS2WXJrc,undiscoveredtruth1,UCmmQvXeuP_8PIaqA4Zk_YCw,2011-02-21 12:02:12.000000,YouTube - White Genocide Across The Globe (The Mantra).mp4.mp4,,,https://i.ytimg.com/vi/vg1gS2WXJrc/hqdefault.jpg,2019-02-28 14:40:04.209242
63,AXjPNV5mMSY,MsCaithness,UCCqeAHyTx1ugL-XPwdryalw,2011-03-13 15:23:15.000000,arnell group: a white genocide and reebok promoter,kill whitey. buy sneakers.,,https://i.ytimg.com/vi/AXjPNV5mMSY/hqdefault.jpg,2019-02-28 14:40:04.774607
64,oN9UIjpkkG4,MsCaithness,UCCqeAHyTx1ugL-XPwdryalw,2011-03-05 19:25:08.000000,visualize white genocide,,,https://i.ytimg.com/vi/oN9UIjpkkG4/hqdefault.jpg,2019-02-28 14:40:04.774607
65,6iQi6uemCiY,RageAgainstNWO,UCCykm3VNiRi48ROPSccHstA,2011-03-09 23:36:40.000000,Zionist genocide of the whites,,,https://i.ytimg.com/vi/6iQi6uemCiY/hqdefault.jpg,2019-02-28 14:40:04.774607
66,KwAboPXO0_4,Reality Dictates,UCWH1cxxm0K1hQkjZvrQAMYA,2011-04-29 16:48:49.000000,White Genocide Nit Wits (SnowWalkerPrime) (MIRROR),"Uploaded by SnowWalkerPrime through his channel on Apr 28, 2011 http://www.youtube.com/user/SomeWhiteDude2 ...",,https://i.ytimg.com/vi/KwAboPXO0_4/hqdefault.jpg,2019-02-28 14:40:05.397790
67,dOpMlFZiDWg,DionysiaWilliams,UC6XywBuBvmHHT69JsFZ4A5g,2011-05-27 16:42:55.000000,&quot;WHITE GENOCIDE IN AFRICA&quot; THE BEGINNING OF THE END !,http://www.governmentlocaljobs.net/ Check out how you can get a goverment job!,,https://i.ytimg.com/vi/dOpMlFZiDWg/hqdefault.jpg,2019-02-28 14:40:05.978148
68,3kdM0x3aqSI,DionysiaWilliams,UC6XywBuBvmHHT69JsFZ4A5g,2011-05-28 00:38:30.000000,White African Genocide,http://www.governmentlocaljobs.net/ Check out how you can get a goverment job!!,,https://i.ytimg.com/vi/3kdM0x3aqSI/hqdefault.jpg,2019-02-28 14:40:05.978148
69,dByVtdMqBcA,DionysiaWilliams,UC6XywBuBvmHHT69JsFZ4A5g,2011-05-27 17:35:09.000000,White African Genocide,http://www.governmentlocaljobs.net/ Check out how you can get a goverment job!,,https://i.ytimg.com/vi/dByVtdMqBcA/hqdefault.jpg,2019-02-28 14:40:05.978148
70,D14Zxdue5dg,MsCaithness,UCCqeAHyTx1ugL-XPwdryalw,2011-06-21 09:38:33.000000,"Young Turks Blame Whitey For &quot;Race Problem,&quot; Praise HUD Enforcenent Of White Genocide Codes",,,https://i.ytimg.com/vi/D14Zxdue5dg/hqdefault.jpg,2019-02-28 14:40:06.510242
71,2fNIJzizJIg,WASP0013,UC-UootlI2KolcDcpX5MmOow,2011-06-12 22:29:24.000000,White South African Genocide,,,https://i.ytimg.com/vi/2fNIJzizJIg/hqdefault.jpg,2019-02-28 14:40:06.510242
72,jB-OJIS22jE,WASP0013,UC-UootlI2KolcDcpX5MmOow,2011-06-12 18:18:20.000000,The Genocide Of White People,,,https://i.ytimg.com/vi/jB-OJIS22jE/hqdefault.jpg,2019-02-28 14:40:06.510242
73,ziwZ9INZktM,NABI BAYITOUEL,UCFi-EW8yUAB0o3Bt4nU5Xrw,2011-07-24 07:36:47.000000,ESAU IS ROME THE SECRET GENOCIDE OF BLACK HEBREW ISRAELITES: EDOM THE WHITE MAN  PART 1,ESAU IS THE WHITE RACE GMS GREATMILLSTONE IUIC POLIGHT jesus christ hebrew israelites zabach black light skin biracials mix race interracials date ...,,https://i.ytimg.com/vi/ziwZ9INZktM/hqdefault.jpg,2019-02-28 14:40:07.064842
74,S6eX8OcFBGo,monkeytail2002,UC0ZhDKX82Pb6b7pcBnudpeQ,2011-07-31 19:37:37.000000,White Genocide?  Get tae fuck with your pish.,I found this piece of crap and had to deal with it.,,https://i.ytimg.com/vi/S6eX8OcFBGo/hqdefault.jpg,2019-02-28 14:40:07.064842
75,z1LTxH2gO8g,roy2178,UCOu8Xm4ohgsjJb84xYFW7Mg,2011-07-15 20:54:37.000000,genocide of the white race,SEE OUR WEB SITE EXFELON.BIZ.,,https://i.ytimg.com/vi/z1LTxH2gO8g/hqdefault.jpg,2019-02-28 14:40:07.064842
76,Ljxx4qH_prI,BBWulf,UCli45XkEaK2mWTtN7qPu_Uw,2011-08-01 17:45:48.000000,What is the Definition of Genocide,"Originally Uploaded by InternationalRabbit on Jan 28, 2011 Are you pro White? Or pro White genocide? http://www.whiterabbitradio.net.",,https://i.ytimg.com/vi/Ljxx4qH_prI/hqdefault.jpg,2019-02-28 14:40:07.640436
77,iuIH3fuaV8Q,StandbyEurope,UCC6Xw3wJU6prYLaAalWrdng,2011-08-27 03:16:26.000000,Explaination of White Genocide,,,https://i.ytimg.com/vi/iuIH3fuaV8Q/hqdefault.jpg,2019-02-28 14:40:07.640436
78,Cb5LBOM3xOQ,FreeSpeechChannel1,UCusfMtlmc1CBHU9MoxMKwcA,2011-08-10 06:39:03.000000,White genocide.flv,,,https://i.ytimg.com/vi/Cb5LBOM3xOQ/hqdefault.jpg,2019-02-28 14:40:07.640436
79,CncCg9wmrME,VF Plus Gauteng,UCfk8E3PBS7L-jYhvBIUU2qw,2011-09-26 14:47:43.000000,Freedom Front Plus - Isreal&#39;s support against white genocide!,Mr Avigdor Eskin supporting Afrikaners in South-Africa that's being killed on farms from Isreal.,,https://i.ytimg.com/vi/CncCg9wmrME/hqdefault.jpg,2019-02-28 14:40:08.184396
80,jeBsZf6ZfWo,Gabiotta,UCkoWyt_dwjepxDwM2HW_tow,2011-09-28 05:27:53.000000,The White Genocide is a Fiction &amp; Willett Gets The Finger,"White genocide? Off you fuck you silly little twats, there are more important things for us to worry about. Oh, and towards the end I make it quite plain exactly what ...",,https://i.ytimg.com/vi/jeBsZf6ZfWo/hqdefault.jpg,2019-02-28 14:40:08.184396
81,zTdqruYnlTU,xchainlinkx,UC7-FmZjEk7LtFar2kM0O4dQ,2011-09-03 22:12:24.000000,My Response to &quot;White Genocide&quot; Ep. 1,Not sure what's more funny...racism or people trying to justify it. :D.,,https://i.ytimg.com/vi/zTdqruYnlTU/hqdefault.jpg,2019-02-28 14:40:08.184396
82,pW35jfW1dI0,TheWhiteIGNITERS,UC5vb9QfuSg5mnbR4_w01InA,2011-09-20 13:08:03.000000,IS THIS &quot;WHITE GENOCIDE&quot; ?,"SINCE ""MOST"" PEOPLE DO ""NOT BELIEVE"" THAT ""WHITE PEOPLE"" DO NOT HAVE THEIR OWN RACE ! THIS VIDEO IS ""DIRECT PROOF"" THAT WHITES ...",,https://i.ytimg.com/vi/pW35jfW1dI0/hqdefault.jpg,2019-02-28 14:40:08.184396
83,QJJDVZiBO-0,xchainlinkx,UC7-FmZjEk7LtFar2kM0O4dQ,2011-09-09 20:18:37.000000,My Response to &quot;White Genocide&quot; Ep 3,,,https://i.ytimg.com/vi/QJJDVZiBO-0/hqdefault.jpg,2019-02-28 14:40:08.184396
84,oSjXYZ63zP0,xchainlinkx,UC7-FmZjEk7LtFar2kM0O4dQ,2011-09-04 16:25:06.000000,My Response to &quot;White Genocide&quot; Ep 2,Anti-racist = anti-white? Oh all this time I thought it was an act!,,https://i.ytimg.com/vi/oSjXYZ63zP0/hqdefault.jpg,2019-02-28 14:40:08.184396
