,video_id,channel_title,channel_id,video_publish_date,video_title,video_description,video_category,video_thumbnail,collection_date
1754,JeeFvoUHUYw,EUROPA Tv,UCXqpN_lZoZU4FR3vIZXCJiA,2018-02-11 15:19:09.000000,SPLC admits White Genocide is planned,"W A K E  U P   The Southern Poverty Law Center (abbreviated as the SPLC) is an anti-White ""civil rights"" organization set up in Montgomery, Alabama in 1971 by ...",,https://i.ytimg.com/vi/JeeFvoUHUYw/hqdefault.jpg,2019-02-28 14:41:00.430520
1755,AsdpOGMoBQs,Make Britain Great Again,UCoWe8JjDi-0wrdzo--2htHw,2018-02-03 03:46:48.000000,Rape and Genocide of White Africans (The Real &quot;Rainbow&quot; Nation),"If you appreciated this video, we need you to help us make more. Donate please NOW: http://www.patreon.com/mbga Copyright Notice: Unless otherwise stated, ...",,https://i.ytimg.com/vi/AsdpOGMoBQs/hqdefault.jpg,2019-02-28 14:41:00.430520
1756,2hPLjcngAkA,Starbird Disagrees,UCMO0_B_N6bf4acbRaT1Ck2w,2018-02-27 18:36:45.000000,The New Worst Person On The Internet? The Root Author Endorses White Genocide!,"From the always open minded and liberal The Root magazine, Angela Helm openly mocks and blames white farmers being murdered in South Africa, and ...",,https://i.ytimg.com/vi/2hPLjcngAkA/hqdefault.jpg,2019-02-28 14:41:00.430520
1757,pb-dKyTlKLI,SmokeRingsPipeDreams,UCtxjNdKLefNFYv9ae8v-Cjg,2018-02-08 05:30:50.000000,Nancy Pelosi Revealed as Anti-White Racist Who Endorses White Genocide!,In a recent speech promoting illegal aliens she showed her true anti-white racism and the racism of liberals and also endorsed white genocide in a disgusting ...,,https://i.ytimg.com/vi/pb-dKyTlKLI/hqdefault.jpg,2019-02-28 14:41:00.430520
1758,MdXYY1P5DGM,Fight White Genocide,UCQrMfqq8KrkqrNXmvBBvKRg,2018-02-14 21:21:05.000000,EU Council President says White Genocide Must Continue,"EU Council President Donald Tusk states that mass migration must continue, and that a ""solution"" is needed to ""put an end to"" Europeans objecting to White ...",,https://i.ytimg.com/vi/MdXYY1P5DGM/hqdefault.jpg,2019-02-28 14:41:00.430520
1759,FXgxS6QlOF0,Kem 123,UCyF333DurDgOHg6NE7VDEqg,2018-02-16 16:13:41.000000,Lauren Southern &amp; Stefan Molyneux On White Genocide In South Africa,https://www.youtube.com/watch?v=Vw9KPzGvtE0&t=27s the video.,,https://i.ytimg.com/vi/FXgxS6QlOF0/hqdefault.jpg,2019-02-28 14:41:00.430520
1760,uEorRTKi9HQ,Kevin Admire,UC8ImFBVi3RanwcwTRxS_FrA,2018-02-03 05:14:54.000000,This Week In White Genocide EP30: What Is This Manischewitz Stuff? 12 27 17,Alt-Right Andy on PewTube: This Week in #WhiteGenocid. Alt-Right Andy on PewTube: Kmac Talks About the Jewish Dilemma. Alt-Right Andy on PewTube: ...,,https://i.ytimg.com/vi/uEorRTKi9HQ/hqdefault.jpg,2019-02-28 14:41:00.430520
1761,9-4DT6Ea8OA,Riptide88,UC7iYr1PNZ5fql0q4G9YBDXA,2018-02-27 21:30:48.000000,An Asian&#39;s Opinion on White Genocide,"My first attempt at making a quick 'vlog' style video, just getting used to the editing and being in front of a camera. Upcoming videos will be of much better quality, ...",,https://i.ytimg.com/vi/9-4DT6Ea8OA/hqdefault.jpg,2019-02-28 14:41:00.430520
1762,cbPtSyX8hjo,El Papa de los Helados,UCbpps3CxehExe2o47RaoP1A,2018-02-16 03:15:28.000000,"Plushie genocide, make a video about wiccan twinks you white devil","Armenian genocide, plushies and yakub, what more do you need? Oh yeah something entertaining.",,https://i.ytimg.com/vi/cbPtSyX8hjo/hqdefault.jpg,2019-02-28 14:41:00.430520
1763,JgRunQgW0ak,SmokeRingsPipeDreams,UCtxjNdKLefNFYv9ae8v-Cjg,2018-02-01 22:34:08.000000,Secret Long Term Plan To Genocide White Americans Slips Out At Major Anti-White Hate Group Meeting!,Speaker at Anti-White hate group meeting accidently lets slip (on camera) the long term plan to genocide white people in America. Please share this video with ...,,https://i.ytimg.com/vi/JgRunQgW0ak/hqdefault.jpg,2019-02-28 14:41:00.430520
1764,SS7kJ5tS3Z0,Fight White Genocide,UCQrMfqq8KrkqrNXmvBBvKRg,2018-02-08 21:19:14.000000,A Deranged Nancy Pelosi Gloats about Self-Hatred &amp; White Genocide,A mentally disturbed Democratic Party leader Nancy Pelosi openly gloats that her own grandson is brainwashed into self hatred. Then she brags that the goal is ...,,https://i.ytimg.com/vi/SS7kJ5tS3Z0/hqdefault.jpg,2019-02-28 14:41:00.430520
1765,U6sEcVac7Tk,ResistingTheLies,UCOmyclir3U3SuLNNrXotkuw,2018-02-07 07:03:44.000000,Why Won&#39;t They Just Say It? #White Genocide,,,https://i.ytimg.com/vi/U6sEcVac7Tk/hqdefault.jpg,2019-02-28 14:41:00.430520
1766,iyKbosXBoUM,Jonathan Jennings,UCwUUIijPzfVdw-i4DzS213g,2018-02-12 14:46:21.000000,White Genocide Podcast: Brendan Coxsucker,A Globalist scumbag gets falsely accused of sex crime by a whore.,,https://i.ytimg.com/vi/iyKbosXBoUM/hqdefault.jpg,2019-02-28 14:41:00.430520
1767,wZ2Ls4yNdM0,Logan,UCeK-I31GSRQNekz7jwD6PZg,2018-02-14 08:17:53.000000,Swedish Kids Celebrate White Genocide,,,https://i.ytimg.com/vi/wZ2Ls4yNdM0/hqdefault.jpg,2019-02-28 14:41:00.430520
1768,UvtP6txc6hc,Kevin Admire,UC8ImFBVi3RanwcwTRxS_FrA,2018-02-02 21:58:18.000000,"This Week In White Genocide Ep 34: Shut It Down, The Chinese Know! 1 29 18",Alt-Right Andy on PewTube: Shut it Down.The. Click on Uploads because this horizontal view is horrible. I don't know if all new accounts look like this or what.,,https://i.ytimg.com/vi/UvtP6txc6hc/hqdefault.jpg,2019-02-28 14:41:00.430520
1769,FudoZjTZNIo,Kave Man,UCslszOM7-H37LFlVqcSfzEg,2018-02-14 20:35:29.000000,A call for a white genocide.,Michael Moore spews hate for white people.,,https://i.ytimg.com/vi/FudoZjTZNIo/hqdefault.jpg,2019-02-28 14:41:00.430520
1770,3YpFMbU3hXM,dyingalive,UC6EMO6Qwkga35xshqA9WQUQ,2018-02-28 10:37:23.000000,Fleeting Signs of White Genocide | Increase in Black Athlete Hysteria,"Save your energy for the real threats. Links : https://wp.me/pfhW1-9cY Please remember to Like, Share and Subscribe. Thank you. Merchandise: ...",,https://i.ytimg.com/vi/3YpFMbU3hXM/hqdefault.jpg,2019-02-28 14:41:00.430520
1771,33oiK6zhVeU,Tiago Pereira dos Santos Silva,UCsqc5Kfy42LF2pJu9MteW4w,2018-02-12 14:52:29.000000,White Farmers Slaughtered in South Africa   Lauren Southern and Stefan Molyneux,White Farmers Slaughtered in South Africa - Lauren Southern and Stefan Molyneux #trump #SouthAfrica #LaurenSouthern #FarmMurders #itsokaytobeWhite ...,,https://i.ytimg.com/vi/33oiK6zhVeU/hqdefault.jpg,2019-02-28 14:41:00.430520
1772,DFBFapaYPcU,Eardwuldor 'Fence' A暐lbriktsson,UCnDnnrCDAg21_MvxwBYPrAw,2018-02-27 15:47:15.000000,Watered Down Opposition Against White Genocide,,,https://i.ytimg.com/vi/DFBFapaYPcU/hqdefault.jpg,2019-02-28 14:41:00.430520
1773,mhRvNw76iC8,ResistingTheLies,UCOmyclir3U3SuLNNrXotkuw,2018-02-12 22:13:04.000000,The Migrant Crisis Is White Genocide #4,"A few weeks old, thought it might as well go up nonetheless.",,https://i.ytimg.com/vi/mhRvNw76iC8/hqdefault.jpg,2019-02-28 14:41:00.430520
1774,fArZcF-cA38,Jonathan Jennings,UCwUUIijPzfVdw-i4DzS213g,2018-02-12 14:33:13.000000,White Genocide Podcast: Civilisational Collapse,It's coming...,,https://i.ytimg.com/vi/fArZcF-cA38/hqdefault.jpg,2019-02-28 14:41:00.430520
1775,v0MhVvMNeIc,Jhonny Bhoy,UCD5CwgfAaJyRCOdoKikH_AA,2018-02-05 18:17:45.000000,(White Genocide)  EU MEP Nick Griffin confronts EU Parliament &amp; Ana Gomes on Kalergi Plan,,,https://i.ytimg.com/vi/v0MhVvMNeIc/hqdefault.jpg,2019-02-28 14:41:00.430520
1776,sqq6j76Jh1E,Jonathan Jennings,UCwUUIijPzfVdw-i4DzS213g,2018-02-22 13:14:26.000000,White Genocide Podcast: The Conceited Neo-Nazi Hypocrites Of &#39;Far Right Watch&#39;,"The only way to deal with 'Gammas' like 'Far Right Watch' is to crush them with such totally relentless, brutal and overwhelming force that they curl up into a ...",,https://i.ytimg.com/vi/sqq6j76Jh1E/hqdefault.jpg,2019-02-28 14:41:00.430520
1777,wNAS4AHwiho,Jonathan Jennings,UCwUUIijPzfVdw-i4DzS213g,2018-02-12 13:59:59.000000,"White Genocide Podcast: My 3 Main Political Priorities, DESTROY THE 3 PRIME EVILS",I stand against everything that British Baroness Shirley Williams values most.,,https://i.ytimg.com/vi/wNAS4AHwiho/hqdefault.jpg,2019-02-28 14:41:00.430520
1778,ch11bun42o0,Jonathan Jennings,UCwUUIijPzfVdw-i4DzS213g,2018-02-06 14:23:41.000000,White Genocide Podcast-A Very British Coup #BrexitRevolution,Civil war in the UK draws closer...,,https://i.ytimg.com/vi/ch11bun42o0/hqdefault.jpg,2019-02-28 14:41:00.431515
1779,ozP2S5BE-U8,John Schmidt,UCEhx-tRK5ojYXbHapd1_U7Q,2018-02-24 13:41:51.000000,Jewish Crime White Genocide And The Origin Of Communism,Learn who the Bolsheviks truly were.,,https://i.ytimg.com/vi/ozP2S5BE-U8/hqdefault.jpg,2019-02-28 14:41:00.431515
1780,gXKNLtFAb2Y,singthesong,UCyfW4uxyxLyBi-R5rl-81rw,2018-02-07 16:59:35.000000,Weier Vo?lkermord   White GeNOcide Deutsche Untertitel   German subtitle,"Liebe Kameraden diese heutige Zeit, und was JETZT gerade passiert , wird in die Geschichtsbcher eingehen als der gr咤ste, aktiv geplante Genozid der ...",,https://i.ytimg.com/vi/gXKNLtFAb2Y/hqdefault.jpg,2019-02-28 14:41:00.431515
1781,7wPnS2WCumM,Jonathan Jennings,UCwUUIijPzfVdw-i4DzS213g,2018-02-22 12:55:52.000000,White Genocide Podcast: Andrew Littlefair Is Innocent,Another innocent victim of a miscarriage of justice in Islamonazi Britain.,,https://i.ytimg.com/vi/7wPnS2WCumM/hqdefault.jpg,2019-02-28 14:41:00.431515
1782,WiauxKUBf7I,Jonathan Jennings,UCwUUIijPzfVdw-i4DzS213g,2018-02-02 13:32:24.000000,White Genocide Podcast-Adolf Corbyn &amp; #RedISIS,Bad News For Jews!,,https://i.ytimg.com/vi/WiauxKUBf7I/hqdefault.jpg,2019-02-28 14:41:00.431515
1783,7ikoXp96zT0,Libertarian Nationalist,UCKZLSCUSy5y34ZMI5YcHyWA,2018-02-13 20:43:12.000000,Episode #15 | Lessons in Liberty Podcast | White Genocide,I point out the left's hatred for white people and I discuss this concept called White Genocide. - https://wp.me/p8ZdoE-sn Follow here: ...,,https://i.ytimg.com/vi/7ikoXp96zT0/hqdefault.jpg,2019-02-28 14:41:00.431515
1784,fY0eLJzqcvs,Jonathan Jennings,UCwUUIijPzfVdw-i4DzS213g,2018-02-20 13:26:35.000000,White Genocide Podcast: Andrew Littlefair Did Nothing Wrong,"Another miscarriage of justice in Islamonazi Britian. 2018.2.21 UPDATE: The libellous, racist and far-left Nazi terrorist gang ""Far Right Watch"" are trying to get ...",,https://i.ytimg.com/vi/fY0eLJzqcvs/hqdefault.jpg,2019-02-28 14:41:00.431515
1785,ophP_OaXeM8,Jonathan Jennings,UCwUUIijPzfVdw-i4DzS213g,2018-02-02 13:28:33.000000,White Genocide Podcast-Fuck Weimar UK,Soyonara Britain!,,https://i.ytimg.com/vi/ophP_OaXeM8/hqdefault.jpg,2019-02-28 14:41:00.431515
1786,TOlvkqeN-f0,Bill Romansky,UCIMeEXI4nhm9fSdBoPSiIIA,2018-02-04 06:16:38.000000,Black Genocide By White Liberals,"Really, we are one under God.",,https://i.ytimg.com/vi/TOlvkqeN-f0/hqdefault.jpg,2019-02-28 14:41:00.431515
1787,qlc1qJFM4xI,BlakeofDarkness,UCbGDEz_3YmypRUDUw1tQNPA,2018-02-03 20:06:06.000000,The Endgame = White Genocide..!!,"From: .any of the following acts committed with intent to destroy, in whole or in part, a national, ethnical, racial or religious. The Endgame Full White Genocide ...",,https://i.ytimg.com/vi/qlc1qJFM4xI/hqdefault.jpg,2019-02-28 14:41:00.431515
1788,BfoWV-Kstr0,Babylon Nuked,UCRt1unOOfshQHWwbWaM6Jsw,2018-02-13 02:29:45.000000,White Prof calls for genocide of white people..,Link to news article ...,,https://i.ytimg.com/vi/BfoWV-Kstr0/hqdefault.jpg,2019-02-28 14:41:00.431515
1789,ULEx-rWdc4Y,Pnoid News,UCTlXey1-ubW-bABh8tJ7L9g,2018-02-14 17:15:57.000000,White south african genocide.  #savetheboers,Get this hash tag going #savetheboers.,,https://i.ytimg.com/vi/ULEx-rWdc4Y/hqdefault.jpg,2019-02-28 14:41:00.431515
1790,6t_3HAj_xrw,Yes You,UCswfoT0pw_XKtDIIxcARUsQ,2018-02-26 00:23:55.000000,White Genocide is real.,"Channel; The Liberty Hound Date; 02/13/2018 Subject; Tucker Carlson, ""Actually it's not your country"" Commenter; Jake Johnson It's the reply to Jake Johnson ...",,https://i.ytimg.com/vi/6t_3HAj_xrw/hqdefault.jpg,2019-02-28 14:41:00.431515
1791,0ld4Lk2QsQQ,KC Comeback,UCKGT067UCn8SF4SdAsjOrjQ,2018-02-13 17:29:43.000000,Trump Wants DACA While Muslim Antichrist Obamanation Wants a White Christian Genocide,Trump Wants DACA While Muslim Antichrist Obamanation Wants a White Christian Genocide with Whites Beheaded Like His Christian Holocaust in the Middle ...,,https://i.ytimg.com/vi/0ld4Lk2QsQQ/hqdefault.jpg,2019-02-28 14:41:00.431515
1792,_SKpuXhbQEA,CypressRage,UCBLpR-yb5wIgggx3yi2soVg,2018-02-19 19:35:08.000000,White genocide,This retarded people want to ruin white Europe so bad.,,https://i.ytimg.com/vi/_SKpuXhbQEA/hqdefault.jpg,2019-02-28 14:41:00.431515
1793,vbbNZqaamnI,DaSchienenfresser,UCpsPQJDUJNrmaJdhaW5VJ5g,2018-02-18 18:58:02.000000,COUDENHOVE KALERGI PLAN IN BIBEL AUFGEDECKT   White Genocide 720p,,,https://i.ytimg.com/vi/vbbNZqaamnI/hqdefault.jpg,2019-02-28 14:41:00.431515
1794,l31zX1H7t-E,PAUL LANSKY,UCN2t5THdQHq00bxPqc5_ikg,2018-02-21 05:37:14.000000,White on black genocide,Stop unnecessary vaccination on your self or your child.,,https://i.ytimg.com/vi/l31zX1H7t-E/hqdefault.jpg,2019-02-28 14:41:00.431515
1795,gM-6zybX430,Charis Arn,UCl7ivXcjN5Ylh07OkQmzIcw,2018-02-22 21:52:40.000000,The Endgame Full White Genocide Documentary,"The Endgame Full White Genocide Documentary. From: .any of the following acts committed with intent to destroy, in whole or in part, a national, ethnical, racial ...",,https://i.ytimg.com/vi/gM-6zybX430/hqdefault.jpg,2019-02-28 14:41:00.786735
1796,bO6L5VIqVsU,I Know Some Things,UC7qqUckmTm0iAkuLW19xmRQ,2018-02-16 04:02:30.000000,White power ranger wants to learn genocide,Get it.,,https://i.ytimg.com/vi/bO6L5VIqVsU/hqdefault.jpg,2019-02-28 14:41:00.786735
1797,oTsV8oT3Q_Y,Lee T,UCEunnuWB4n0Nq-INh0KeAuQ,2018-02-28 12:46:43.000000,Celebrating white genocide via mass migration,,,https://i.ytimg.com/vi/oTsV8oT3Q_Y/hqdefault.jpg,2019-02-28 14:41:00.787732
1798,iG8deHsmujI,Social Genocide,UCqV1jgDCu9ewhPXiA0AbHOQ,2018-02-03 21:59:53.000000,White Genocide,,,https://i.ytimg.com/vi/iG8deHsmujI/hqdefault.jpg,2019-02-28 14:41:00.787732
1799,JAJuwbnGyLI,gay man,UCDZwHbXzoLbIAs-Krxru_hw,2018-02-23 01:42:38.000000,white genocide edit,,,https://i.ytimg.com/vi/JAJuwbnGyLI/hqdefault.jpg,2019-02-28 14:41:00.787732
1800,qRP-2qYV2Kc,gay man,UCDZwHbXzoLbIAs-Krxru_hw,2018-02-23 01:42:36.000000,white genocide,,,https://i.ytimg.com/vi/qRP-2qYV2Kc/hqdefault.jpg,2019-02-28 14:41:00.787732
1801,85Oelal-gyU,Avi Yemini,UCrOXPKiTSfjY-z7y0MeR05w,2018-03-26 01:30:14.000000,WHY RACIST REFUGEE SUPPORTERS CHEER WHITE GENOCIDE,"Support my work ?   https://goo.gl/kTRfcC Yesterday I attended a massive pro-refugee rally in Melbourne, hoping to attract thousands of signatures for our ...",,https://i.ytimg.com/vi/85Oelal-gyU/hqdefault.jpg,2019-02-28 14:41:01.454964
1802,4yuMhm7S7Gg,One America News Network,UCNbIDJNNgaRrXOD7VllIMRQ,2018-03-29 13:01:45.000000,South Africa Advances &#39;Anti-White&#39; Policies Amid Rise in Farm Murders,The black majority government of South Africa intensifies its attack against the white Afrikaner minority. One America's Kristian Rouz examines the issue of ...,,https://i.ytimg.com/vi/4yuMhm7S7Gg/hqdefault.jpg,2019-02-28 14:41:01.454964
1803,5z5c2-Wh8KY,Multimedia LIVE,UCxPPgRYHH1NSp2Ya_ROiXxw,2018-03-02 10:30:41.000000,넹hites must be happy we are not calling for genocide: Malema on land expropriation,EFF leader Julius Malema said they would take land 'without a drop of blood' while speaking to a crowd of supporters in Soweto on Wednesday February 28 ...,,https://i.ytimg.com/vi/5z5c2-Wh8KY/hqdefault.jpg,2019-02-28 14:41:01.454964
1804,DrDEb4p3wU4,BlazeTV,UCKgJEs_v0JB-6jWb8lIy9Xw,2018-03-08 19:14:30.000000,White South Africans Face Genocide,South African parliament voted to allow the seizure of land from white farmers without compensation. Check out the full story here: ...,,https://i.ytimg.com/vi/DrDEb4p3wU4/hqdefault.jpg,2019-02-28 14:41:01.454964
1805,mfcBs8j5NsU,Sydney Watson,UCSFy-1JrpZf0tFlRZfo-Rvw,2018-03-22 00:55:48.000000,SOUTH AFRICAN GENOCIDE EXPLAINED,Useful links: Video used: https://www.youtube.com/watch?v=FT3CLYhrCyA Who is Robert Mugabe: https://www.history.com/topics/robert-mugabe Govt info on ...,,https://i.ytimg.com/vi/mfcBs8j5NsU/hqdefault.jpg,2019-02-28 14:41:01.454964
1806,dcYG6T-WjpY,Mark Collett,UCdf14z6V0MWNeVcbAz0r8wQ,2018-03-01 13:00:05.000000,White Genocide Explained,European nations and indeed all Western countries are facing an unprecedented demographic change  one which will see those of European descent become ...,,https://i.ytimg.com/vi/dcYG6T-WjpY/hqdefault.jpg,2019-02-28 14:41:01.454964
1807,5XuleoPg-P8,Search For Uhuru,UC2rmgVaijnf92nixlIZWGmg,2018-03-29 17:24:30.000000,Lauren Southern and The Lie of White Genocide In South Africa w/ Sisana,Please Subscribe. Patreon: https://www.patreon.com/searchforuhuru Instagram: Searchforuhuru instagram: Africapersonified Facebook: ...,,https://i.ytimg.com/vi/5XuleoPg-P8/hqdefault.jpg,2019-02-28 14:41:01.454964
1808,NvCwtU1wVp4,Avi Yemini,UCrOXPKiTSfjY-z7y0MeR05w,2018-03-29 09:44:43.000000,THE PLIGHT OF WHITE SOUTH AFRICAN FARMERS,I almost cried producing this video. #whitegenocide We have to stop importing the wrong Africans. Swap the Sudanese and Somalians for white South African ...,,https://i.ytimg.com/vi/NvCwtU1wVp4/hqdefault.jpg,2019-02-28 14:41:01.454964
1809,AWV1oCSCQCo,proud youthoftheworld,UCKG09l9FqKkCGOaogn8FjAA,2018-03-29 15:20:14.000000,LAND EXPROPRIATION IN SOUTH AFRICA // IS THIS A WHITE GENOCIDE,Thanks for watching.,,https://i.ytimg.com/vi/AWV1oCSCQCo/hqdefault.jpg,2019-02-28 14:41:01.454964
1810,bDrV8iWdK6c,BaRKy,UCyv2yBPobX_LIMWxu5-cGHQ,2018-03-20 18:07:21.000000,"The Current Situation in South Africa || Taking Land, White Genocide, New President.","South Africa's gotten a lot of publicity in the news recently, whether it's about the land grab, land expropriation, the new president coming in, the old president's ...",,https://i.ytimg.com/vi/bDrV8iWdK6c/hqdefault.jpg,2019-02-28 14:41:01.454964
1811,Oi94YJpQkjU,Search For Uhuru,UC2rmgVaijnf92nixlIZWGmg,2018-03-30 17:58:53.000000,It&#39;s White on White Crime Not White Genocide In South Africa w/ Sisana,Please Subscribe Patreon: https://www.patreon.com/searchforuhuru Instagram: Searchforuhuru instagram: Africapersonified Facebook: ...,,https://i.ytimg.com/vi/Oi94YJpQkjU/hqdefault.jpg,2019-02-28 14:41:01.454964
1812,K6CkF8Ub4aM,sniperkitty 1400xx,UC1mTYRed1wc1pQLKqmSk7JQ,2018-03-11 11:35:50.000000,The Endgame   Full White Genocide Documentary,White Genocide is real.,,https://i.ytimg.com/vi/K6CkF8Ub4aM/hqdefault.jpg,2019-02-28 14:41:01.454964
1813,nsCFTOnCkwA,DyslexicRobot NEWS,UCj-PSqRlMJUZLFcfVV_RmbQ,2018-03-19 04:15:18.000000,south africa white genocide,south africa white genocide.,,https://i.ytimg.com/vi/nsCFTOnCkwA/hqdefault.jpg,2019-02-28 14:41:01.454964
1814,PhJTlq5ST4U,MalcolmXGreatAgain,UCI-grgiYeM8j-6gTkJvA_2w,2018-03-03 03:11:20.000000,Julius Malema POWERFUL SPEECH On White Land Seizure (27 Feb. 2018),"FOLLOW US ON FACEBOOK: https://www.facebook.com/MALCOLMXFILES #JuliusMalema, the dynamic leader of South Africa's powerful Economic Freedom ...",,https://i.ytimg.com/vi/PhJTlq5ST4U/hqdefault.jpg,2019-02-28 14:41:01.454964
1815,C4vYaBYKojc,SA-News,UCYbI0nJEA-b8D4tTawzfLPw,2018-03-26 20:11:55.000000,Yet Another Australian Politician Says 늅outh African White Farmers at risk of Genocide,"SAFFAs (South Africans Abroad), showed their support for the Australian Government's efforts to assist persecuted South African farmers. The march in solidarity ...",,https://i.ytimg.com/vi/C4vYaBYKojc/hqdefault.jpg,2019-02-28 14:41:01.454964
1816,grWVNp8ZeQU,NoRace,UCGrhs0BwaYwY-A7oHgVelzA,2018-03-05 03:42:23.000000,Sargon &amp; Vee Have A Plan to End White Genocide! BE &quot;Sneetches&quot; Brave New World 뉵reeding Programs?,The word of the Day is: 늀anufactured ...The Manufactured Threat of #whiteGenocide + Manufacturing of #BrownGenocide= World Peace?    ??Right?,,https://i.ytimg.com/vi/grWVNp8ZeQU/hqdefault.jpg,2019-02-28 14:41:01.454964
1817,dxdBDjBH1cU,Steve Trueblue,UCqDUhDiWJdk3inMxtEPOUWw,2018-03-18 14:01:37.000000,SA Evacuation pre  White Genocide  How did we get here? Pt 1,Peter Dutton Aust Immigration Minister wants to rescue the imperilled white tribe as urgent refugees.He is taking a lot of flak for caring about whites. Solution ...,,https://i.ytimg.com/vi/dxdBDjBH1cU/hqdefault.jpg,2019-02-28 14:41:01.454964
1818,EDd55khoX1k,eyeslevel,UC00751cgsU5hR8VhCn18V0g,2018-03-17 23:37:56.000000,The Stop White Genocide Video,,,https://i.ytimg.com/vi/EDd55khoX1k/hqdefault.jpg,2019-02-28 14:41:01.454964
1819,6lBEbYnfJfw,Jonathan Jennings,UCwUUIijPzfVdw-i4DzS213g,2018-03-19 14:55:41.000000,White Genocide Podcast: Britain Has Fallen #CuckIsland,We're DOOMED!,,https://i.ytimg.com/vi/6lBEbYnfJfw/hqdefault.jpg,2019-02-28 14:41:01.454964
1820,nCocs4rLLVQ,Steve Trueblue,UCqDUhDiWJdk3inMxtEPOUWw,2018-03-20 11:22:08.000000,SA Evacuation pre White Genocide How did we get here? Pt 2,SA Evacuation pre White Genocide How did we get here? Pt 2 Solution offered Poignant Last White Rhino dies ...,,https://i.ytimg.com/vi/nCocs4rLLVQ/hqdefault.jpg,2019-02-28 14:41:01.454964
1821,G-6HNBCmxjo,Blaze Ontheright,UCZKt8pn0vag2uLKVBRz0Lwg,2018-03-17 07:41:32.000000,White Genocide In South Africa &amp; The Fate Of The European Nations,In this video I discuss how ''The Rainbow Nation'' decided to recently confiscate the land and property of white farmers without compensation and the ongoing ...,,https://i.ytimg.com/vi/G-6HNBCmxjo/hqdefault.jpg,2019-02-28 14:41:01.454964
1822,-I__Mz204xg,blackbird9's Breakfast Club,UCSJ4LNPa1cJBB-XydNGGxSQ,2018-03-15 02:35:48.000000,Pondering White Genocide In South Africa - Blackbird9 Podcast,"Welcome to Blackbird9's Breakfast Club's Wednesday Podcast Pondering Genocide In South Africa. Tonight we will be interviewing Miss Karin Smith, the King of ...",,https://i.ytimg.com/vi/-I__Mz204xg/hqdefault.jpg,2019-02-28 14:41:01.454964
1823,0FPhLPXS_fA,No Apologies,UCQ3ZLEjzIQ6FHpibrZjon6A,2018-03-04 04:03:59.000000,White Genocide in South Africa,"Josh talks about the treatment of white farmers in South Africa, media hypocrisy, and the violence of Marxism. Find Josh on Twitter, Gab, Periscope, and Minds: ...",,https://i.ytimg.com/vi/0FPhLPXS_fA/hqdefault.jpg,2019-02-28 14:41:01.455958
1824,bpk7XsOcWBQ,LMSTactical,UCiGB4A7syGkrO6wQA0SAaUw,2018-03-28 19:32:44.000000,White Genocide,South Africa Needs You.,,https://i.ytimg.com/vi/bpk7XsOcWBQ/hqdefault.jpg,2019-02-28 14:41:01.455958
1825,THpSlMbkZyU,?Ninj,UCdt8VqhKEsnmuNHdyDgp8OQ,2018-03-15 11:51:32.000000,The Horrible truth Australians can expect from &quot;The White Genocide!&quot;,"If this video made you angry, please see the rest of our videos where we show you how asleep you are.",,https://i.ytimg.com/vi/THpSlMbkZyU/hqdefault.jpg,2019-02-28 14:41:01.455958
1826,ya3cwd-EW6E,Timothy Breitholtz,UCv4iUCRkqD1VLClVTJ-SEhA,2018-03-06 01:06:15.000000,London Civil War UK bombing terrorism White Genocide,,,https://i.ytimg.com/vi/ya3cwd-EW6E/hqdefault.jpg,2019-02-28 14:41:01.455958
1827,5Hgbloz1-P4,That's Just My View,UCeCDMe1o14OHdrS1OVnZpRg,2018-03-08 21:05:45.000000,"Slave Trade in Libya - White Genocide &amp; Land Confiscation in South Africa...but, Muh Wakanda!",The world over are blowing their minds over the incredible run the 'Black Panther' movie has had domestically and globally. Soon to be one of the very few ...,,https://i.ytimg.com/vi/5Hgbloz1-P4/hqdefault.jpg,2019-02-28 14:41:01.455958
1828,Ojp1tMbwDHk,SmokeRingsPipeDreams,UCtxjNdKLefNFYv9ae8v-Cjg,2018-03-08 18:24:12.000000,What is White Genocide?,Please support my channel on Patreon: https://www.patreon.com/user?u=2889059&ty=h ~FAIR USE~ Copyright Disclaimer Under Section 107 of the Copyright ...,,https://i.ytimg.com/vi/Ojp1tMbwDHk/hqdefault.jpg,2019-02-28 14:41:01.455958
1829,57h-g8f5t8c,Read SIEGE by James Mason Read SIEGE by James Mason,UC-ksTG6j9aZND1Hgqbc5lSw,2018-03-26 21:19:16.000000,"WHITE GENOCIDE: South Africa, why the media silence?",Blair Cottrell explains.,,https://i.ytimg.com/vi/57h-g8f5t8c/hqdefault.jpg,2019-02-28 14:41:01.455958
1830,_gFNvy111qk,Satarafikha I Love You,UCYLAH1G2KTDdFS1TLZsOzFg,2018-03-28 00:04:31.000000,australians protest against white genocide in south africa,"A protest by white Australians against the alleged white genocide or farm killings in South Africa. Please like, comment, share and subscribe. Click below for ...",,https://i.ytimg.com/vi/_gFNvy111qk/hqdefault.jpg,2019-02-28 14:41:01.455958
1831,_ZB7TSEPr1o,Themistocles,UCd0dqTsS3OMH4yaNHBh6nNw,2018-03-02 18:36:18.000000,White Genocide Explained - Mark Collett,European nations and indeed all Western countries are facing an unprecedented demographic change  one which will see those of European descent become ...,,https://i.ytimg.com/vi/_ZB7TSEPr1o/hqdefault.jpg,2019-02-28 14:41:01.455958
1832,_WKsMy-o86M,Zelus Zombie,UCCJ-LSmF5flNnsa_AoJ_OxA,2018-03-31 12:10:29.000000,The War on Whites - EXPOSING the Plan for White Genocide,XXXTENTACION - Look At Me! (Official Video) https://www.youtube.com/watch?v=LQwbaXMVslM.,,https://i.ytimg.com/vi/_WKsMy-o86M/hqdefault.jpg,2019-02-28 14:41:01.455958
1833,VfPtKiqVd-M,Jonathan Jennings,UCwUUIijPzfVdw-i4DzS213g,2018-03-02 14:57:54.000000,White Genocide Podcast: Then They Came For Sargon #Sargone,"Now Google declares war on the ""Liberalists"".",,https://i.ytimg.com/vi/VfPtKiqVd-M/hqdefault.jpg,2019-02-28 14:41:01.455958
1834,VvzPQ_q9IsY,FreePress Tv,UCkit3o-8dsJSGEivxCKEPnw,2018-03-07 02:46:59.000000,AIPAC is White Genocide 2018 Documentary,http://911MissingLinks.com.,,https://i.ytimg.com/vi/VvzPQ_q9IsY/hqdefault.jpg,2019-02-28 14:41:01.455958
1835,Ac9UnjHrCKA,Timothy Breitholtz,UCv4iUCRkqD1VLClVTJ-SEhA,2018-03-06 00:39:24.000000,European Immigration Refugee Crisis  White Genocide!,,,https://i.ytimg.com/vi/Ac9UnjHrCKA/hqdefault.jpg,2019-02-28 14:41:01.455958
1836,Kg8VqhxX1oI,Timothy Breitholtz,UCv4iUCRkqD1VLClVTJ-SEhA,2018-03-06 00:22:25.000000,Barbara Lerner Spectre on White Genocide,,,https://i.ytimg.com/vi/Kg8VqhxX1oI/hqdefault.jpg,2019-02-28 14:41:01.455958
