,video_id,channel_title,channel_id,video_publish_date,video_title,video_description,video_category,video_thumbnail,collection_date
1157,bi3rR8HI_js,Jabril woodzz,UC4YlQCqu1krqjQmLyIvqJkg,2017-01-02 16:50:17.000000,Is white genocide real?????,I don't own the right to this movie.,,https://i.ytimg.com/vi/bi3rR8HI_js/hqdefault.jpg,2019-02-28 14:40:48.671043
1158,x1HEadOCFpI,Ben Loots,UCAWvoKoIxnYVrdaylrmLBUg,2017-01-19 17:32:42.000000,White genocide in South Africa,White Afrikaner farmers murdered.,,https://i.ytimg.com/vi/x1HEadOCFpI/hqdefault.jpg,2019-02-28 14:40:48.671043
1159,mN0y1Zcdd08,BUGS FWG,UC63VXYk6YCOK4I8ggKLK1Sg,2017-01-08 06:46:32.000000,Beefcake뇹 Bootcamp - #23 Non-Whites Talking About White GeNOcide,Beefcake's Bootcamp is a podcast designed to train people in how to tackle anti-Whites with practical politics. Beefcake is an excellent speaker who gets his ...,,https://i.ytimg.com/vi/mN0y1Zcdd08/hqdefault.jpg,2019-02-28 14:40:48.671043
1160,S6XHBei8hic,Big Thoughts,UCz79h_tWLr4RTwZ0KtDJrtw,2017-01-29 10:33:54.000000,Big Thoughts - Stephen Hawking Discusses White Genocide,I created this video with the YouTube Video Editor (http://www.youtube.com/editor),,https://i.ytimg.com/vi/S6XHBei8hic/hqdefault.jpg,2019-02-28 14:40:48.671043
1161,4QZ6K4zHYXM,BUGS FWG,UC63VXYk6YCOK4I8ggKLK1Sg,2017-01-08 06:47:54.000000,Beefcake뇹 Bootcamp - #26 White GeNOcide in the News,Beefcake's Bootcamp is a podcast designed to train people in how to tackle anti-Whites with practical politics. Beefcake is an excellent speaker who gets his ...,,https://i.ytimg.com/vi/4QZ6K4zHYXM/hqdefault.jpg,2019-02-28 14:40:48.671043
1162,opfJU1anYas,VirtueTV JustHereHavingFun,UC9NuFBqyv8jMe1y1CHNeXJA,2017-01-22 20:00:46.000000,VirtueTV presents - The Reality of white GENOCIDE | FEAR OF BREEDOUTRACISM,"One of a fragment from the fair minded and ethical Bro.VIrtue, Well in this episode we have ""The Reality of White Genocide"" part of the ""BREEDOUTRACISM"" ...",,https://i.ytimg.com/vi/opfJU1anYas/hqdefault.jpg,2019-02-28 14:40:48.671043
1163,-I5nGRXY3qE,Exclusive Good News,UCBOpMJt_qBhdAet81PTUHpg,2017-01-04 20:53:58.000000,THE PLANNED WHITE GENOCIDE!,SUBSCRIBE AND LIKE FOR MORE! I created this video with the YouTube Video Editor (http://www.youtube.com/editor),,https://i.ytimg.com/vi/-I5nGRXY3qE/hqdefault.jpg,2019-02-28 14:40:48.671043
1164,w34LbWoMmqo,Optimized Robotics,UCV4mxvNgqAWYrSvrl5p5ZZQ,2017-01-18 10:57:43.000000,White Genocide,,,https://i.ytimg.com/vi/w34LbWoMmqo/hqdefault.jpg,2019-02-28 14:40:48.671043
1165,-Ud95NVxJrY,Tanya Masters,UCUh8AHJHdORvDIc87J-XW_g,2017-01-12 10:33:37.000000,The Endgame   Full White Genocide Documentary,The Conspiracy to destroy and replace all WHITE PEOPLE. to destroy forever the EUROPEAN RACE.,,https://i.ytimg.com/vi/-Ud95NVxJrY/hqdefault.jpg,2019-02-28 14:40:48.671043
1166,Fz4JkbMLxj4,R??????,UCGce7E693MU3ozUEm-2LBew,2017-01-02 19:55:58.000000,White Genocide,White genocide. How long does the white race have left.,,https://i.ytimg.com/vi/Fz4JkbMLxj4/hqdefault.jpg,2019-02-28 14:40:48.671043
1167,Ybu2QA7B5ng,vorhaut lootscher,UCvLrOL8YCQXyHt2ZbiFlRlQ,2017-01-19 08:23:20.000000,02  Solutions series 10  White genocide 4,,,https://i.ytimg.com/vi/Ybu2QA7B5ng/hqdefault.jpg,2019-02-28 14:40:48.671043
1168,ywsQk0n24B8,Bobbye Pearcy,UCig6iDjppNl9g5sq6NJt2MA,2017-01-29 04:31:10.000000,"Drexel University Professor Tweets &quot;I want White Genocide&quot; George Ciccariello Maher,","Why is it considered the social norm and acceptable for a college professor to tweet all they want for Christmas is ""White Genocide"" ...",,https://i.ytimg.com/vi/ywsQk0n24B8/hqdefault.jpg,2019-02-28 14:40:48.671043
1169,DehpdhULsJE,Deeanna Aretha,UCnHiTzIntMnv8jFVwQtxG9w,2017-01-07 11:33:51.000000,"Drexel University Professor Tweets &quot;I want White Genocide&quot; George Ciccariello Maher,","Why is it considered the social norm and acceptable for a college professor to tweet all they want for Christmas is ""White Genocide"" ...",,https://i.ytimg.com/vi/DehpdhULsJE/hqdefault.jpg,2019-02-28 14:40:48.671043
1170,VSZekFxMulg,vorhaut lootscher,UCvLrOL8YCQXyHt2ZbiFlRlQ,2017-01-19 08:23:20.000000,04  Solutions series 8  white genocide 2,,,https://i.ytimg.com/vi/VSZekFxMulg/hqdefault.jpg,2019-02-28 14:40:48.671043
1171,YL8MBSlgMFg,vorhaut lootscher,UCvLrOL8YCQXyHt2ZbiFlRlQ,2017-01-19 08:23:20.000000,05  Solutions series 7  white genocide,,,https://i.ytimg.com/vi/YL8MBSlgMFg/hqdefault.jpg,2019-02-28 14:40:48.671043
1172,aVFmjYxu5B4,SJW vs LOGIC,UCCXqnI4FmOlCHTgRJU99VGw,2017-01-15 13:13:36.000000,SJW vs LOGIC  WHITE GENOCIDE  Feminist  Social Justice Warriors  SJW,,,https://i.ytimg.com/vi/aVFmjYxu5B4/hqdefault.jpg,2019-02-28 14:40:48.671043
1173,R20ApJf0_Po,vorhaut lootscher,UCvLrOL8YCQXyHt2ZbiFlRlQ,2017-01-19 14:38:11.000000,02  Solutions series 10  White genocide 4,,,https://i.ytimg.com/vi/R20ApJf0_Po/hqdefault.jpg,2019-02-28 14:40:49.010554
1174,5e-iOzn_8lA,vorhaut lootscher,UCvLrOL8YCQXyHt2ZbiFlRlQ,2017-01-19 14:47:43.000000,03  Solutions series 9  white genocide 3,,,https://i.ytimg.com/vi/5e-iOzn_8lA/hqdefault.jpg,2019-02-28 14:40:49.010554
1175,_a-5gPG3uss,vorhaut lootscher,UCvLrOL8YCQXyHt2ZbiFlRlQ,2017-01-19 08:23:20.000000,03  Solutions series 9  white genocide 3,,,https://i.ytimg.com/vi/_a-5gPG3uss/hqdefault.jpg,2019-02-28 14:40:49.010554
1176,36HFuvNw6VE,vorhaut lootscher,UCvLrOL8YCQXyHt2ZbiFlRlQ,2017-01-19 14:38:25.000000,05  Solutions series 7  white genocide,,,https://i.ytimg.com/vi/36HFuvNw6VE/hqdefault.jpg,2019-02-28 14:40:49.010554
1177,Vj3b8JQ1Y7s,The Young Turks,UC1yBKRuGpC1tSM73A0ZjYjQ,2017-02-11 04:30:00.000000,Alt-Right Thinks Anti-Blackface Trailer Is &quot;White Genocide&quot;,"Racists think everything is an existential threat to white people. Ben Mankiewicz, Hannah Cranston, Brett Erlich, and Aida Rodriguez, hosts of The Young Turks, ...",,https://i.ytimg.com/vi/Vj3b8JQ1Y7s/hqdefault.jpg,2019-02-28 14:40:49.667426
1178,_8VX6HEmq9I,TheAlmonteFilms,UC4C_SF5koS4Q5om50b9NMTw,2017-02-27 08:38:45.000000,&#39;Dear White People&#39; Outrage || Trailer Reaction&#39;s Reaction,"And I thought us leftists were the snowflakes... either no one knows what satire is, or everyone hopped on the outrage-train for ad revenue to appeal to the ...",,https://i.ytimg.com/vi/_8VX6HEmq9I/hqdefault.jpg,2019-02-28 14:40:49.667426
1179,KMX_YFo0gAk,Inconvenient Truth,UCEDb6cCVH8QV8Lt6nYfYdVA,2017-02-26 16:26:05.000000,White Genocide in South Africa is REAL! Farm Murders and Attacks!,White South African Farmers are on the brink of Extinction!!! We need the world to open it's eyes to the brutality that is happening RIGHT NOW! The government ...,,https://i.ytimg.com/vi/KMX_YFo0gAk/hqdefault.jpg,2019-02-28 14:40:49.667426
1180,3SWkHzppqXI,ClusterVisionMach2,UCTdDKq6VbvLMx4II7uDE0Pw,2017-02-06 19:47:39.000000,COUDENHOVE KALERGI PLAN IN BIBEL AUFGEDECKT | White Genocide,"Coudenhove Kalergi wollte eine braune Mischrasse fr Europa. ""Datt glaub ich nich'!"" ... ""Nein, Du vermutest; aber prfe doch selbst u. h他e zu."" Musik ...",,https://i.ytimg.com/vi/3SWkHzppqXI/hqdefault.jpg,2019-02-28 14:40:49.668440
1181,7wKIpdHhe7o,Alt-Right Tankie,UCFWmmu2MmGW8Obc5pNDDJmw,2017-02-21 14:10:19.000000,Paul Gottfried: Why so many Jews are pushing for white genocide,,,https://i.ytimg.com/vi/7wKIpdHhe7o/hqdefault.jpg,2019-02-28 14:40:49.668440
1182,wEN8EzVFQAY,Conncast,UCv6ur-PkuhCG-lVJcd3Px0w,2017-02-21 16:06:35.000000,Conncast Plays Victoria 2 SA Part 1: White Genocide,I once more put my implicitness on the forefront of conversation by playing Victoria 2 HOD unmodded and not being used to talking in my Victoria sessions ...,,https://i.ytimg.com/vi/wEN8EzVFQAY/hqdefault.jpg,2019-02-28 14:40:49.668440
1183,3ASjmA8oi3s,Lisa Bright,UCfYfmVAaTpnje7Kc2lSezzw,2017-02-01 12:25:43.000000,Face Up To Racism and promote White Genocide on SBS Ray Martin,"New SBS anti-white propaganda coming our way with Ray Martin. Africa for the Africans, Asia for the Asians, White countries for everyone? Everybody says ...",,https://i.ytimg.com/vi/3ASjmA8oi3s/hqdefault.jpg,2019-02-28 14:40:49.668440
1184,XRN0kPiAO98,New Possibilities,UCk535X5g0IKsQaN3toyWqwg,2017-02-10 04:02:50.000000,"Dear White People, Shut the Hell Up","Donate to New Possibilities https://www.youtube.com/user/ansonasaka/about Dear White People, Netflix, boycott, ant-white, anti-European, white genocide, ...",,https://i.ytimg.com/vi/XRN0kPiAO98/hqdefault.jpg,2019-02-28 14:40:49.668440
1185,l4Nsual8nx8,Tullius Cicero,UCgEQS-p5tI3YR4AbuzdOIug,2017-02-11 10:14:02.000000,Stefan Molyneux Endorses Richard Spencer&#39;s DemographicWinter/&#39;White Genocide&#39; Lies,"Since the early 1900s, the original eugenicists, such as E.A. Ross and Theodore Roosevelt, complained that WASPs in the USA were being out-bred by other ...",,https://i.ytimg.com/vi/l4Nsual8nx8/hqdefault.jpg,2019-02-28 14:40:49.668440
1186,qB711LcK3ew,Tabor 7,UCqeyIQ7kFFNBVx5-JzVzgnw,2017-02-19 11:31:00.000000,What is White Genocide? (New World Order) (Barbara Spectre),"This video is a continuation of my small youtube video ""Britain's treacheries during world war 1 and world war 2."" I also recommend Reventlow's book ""The ...",,https://i.ytimg.com/vi/qB711LcK3ew/hqdefault.jpg,2019-02-28 14:40:49.668440
1187,cm9lVTF8yuA,TheEvilOyo,UCjk17n926ef_FRyfmQKMeig,2017-02-03 03:31:05.000000,TheEviloyo throwback: White Genocide is bullshit,,,https://i.ytimg.com/vi/cm9lVTF8yuA/hqdefault.jpg,2019-02-28 14:40:49.668440
1188,xLise68byGY,Outside the Box TV with Alex Ansary,UCvnnSqnpVWMgfLty440GsuA,2017-02-08 18:52:47.000000,Donald Trump&#39;s &quot;White Genocide&quot; Political Crusaders w/ guest Kyle Rearden -  #FREEMEDIA,The political climate and white genocide rhetoric has never been more violent in the entirely of my lifetime. All independents are falsely being called the LEFT ...,,https://i.ytimg.com/vi/xLise68byGY/hqdefault.jpg,2019-02-28 14:40:49.668440
1189,xy_DStwwr3E,White & Normal,UC5q1_TYHaQNS6A-YiiZHUng,2017-02-11 11:20:40.000000,White Genocide Conspiracy,White Genocide is the worst conspiracy ever because THEY TELL YOU WHAT THEY'RE DOING.,,https://i.ytimg.com/vi/xy_DStwwr3E/hqdefault.jpg,2019-02-28 14:40:49.668440
1190,EsMoqn3TR8Q,??????? ???????,UCl3Ts-mvaGpkcdx8wYAcnBw,2017-02-25 06:45:48.000000,Varg Vikernes supports the White Genocide,"Varg Says Whites are the Problem, Africans are Great and White Genocide is Nature's Solution.",,https://i.ytimg.com/vi/EsMoqn3TR8Q/hqdefault.jpg,2019-02-28 14:40:49.668440
1191,5IGdx7xCueM,Richard Dijkstra,UCXSBdbxyFy7vet-m6aHa55A,2017-02-28 00:47:45.000000,Zio-Wilders about White Genocide in Europe,The United Nations Convention on the Prevention and Punishment of the Crime of Genocide defines the word genocide as: ...any of the following acts committed ...,,https://i.ytimg.com/vi/5IGdx7xCueM/hqdefault.jpg,2019-02-28 14:40:49.668440
1192,d9Vhn9K-jmo,InaneDragon,UC0gudMAW4REHrqdX8co07-Q,2017-02-27 20:30:01.000000,[InaneRebuttal] Still No White Plebocide,"Yup, everyone gets their turn in the barrel. Even a crazy old bloke from Sweden. Or, wherever he's from. Today, we discuss the white genocide, or lack thereof.",,https://i.ytimg.com/vi/d9Vhn9K-jmo/hqdefault.jpg,2019-02-28 14:40:49.668440
1193,S4CXR_MizNY,The Anti-Feminist,UCB8BtE6FcBI-ssnmP6hYInQ,2017-02-18 21:56:01.000000,WHITE PEOPLE ARE JUST THE WORST!!! (PRELUDE TO A GENOCIDE),Sources: http://www.theblaze.com/news/2017/02/15/pennsylvania-college-democrats-are-wearing-white-puzzle-pieces-as-a-privilege-reminder/ ...,,https://i.ytimg.com/vi/S4CXR_MizNY/hqdefault.jpg,2019-02-28 14:40:49.668440
1194,tCa8tml--EI,Jonathan Jennings,UCwUUIijPzfVdw-i4DzS213g,2017-02-23 12:05:25.000000,White Genocide Podcast: Jo Coxsucker,Why the martyrdom cult of Jo Cox's personality failed.,,https://i.ytimg.com/vi/tCa8tml--EI/hqdefault.jpg,2019-02-28 14:40:49.668440
1195,nhadoLQD6Bo,Kimbelina H,UCeRymHCDSmIWVo_n8smCDbw,2017-02-17 20:51:32.000000,MUSLIM RAPE ANTI WHITE GENOCIDE Europe Muslim JIHAD RAPE CHILDREN,"Muslim koran tells them to live peaceably until they have huge numbers and then kill all others! We must stop their growth in America! Muslims rape, commit ...",,https://i.ytimg.com/vi/nhadoLQD6Bo/hqdefault.jpg,2019-02-28 14:40:49.668440
1196,BfbL-3ZyE30,Dawid Brink,UCbJkDfNNbczrIAEaQ_9GLJA,2017-02-23 09:41:50.000000,GENOCIDE OF WHITE SOUTH AFRICANS..FARMERS!!,Video from Dawid Brink.,,https://i.ytimg.com/vi/BfbL-3ZyE30/hqdefault.jpg,2019-02-28 14:40:49.668440
1197,ZWKOC2LX6qc,Liberty Blue,UCEGbwS1O4SSZUEENBiN39aw,2017-02-25 11:17:56.000000,CBC&#39;s &#39;22 Minutes&#39; shows their &quot;comedy&quot; with celebration of white genocide,"Faith Goldy of TheRebel.media looks at a racist sketch that aired on a CBC comedy show. If you'd like to say #byebyeCBC #DefundCBC, click here to sign: ...",,https://i.ytimg.com/vi/ZWKOC2LX6qc/hqdefault.jpg,2019-02-28 14:40:49.668440
1198,B2AlaxGD8sc,Three Guns,UC-SBnC3LI-Q4TrH9YQBDIoQ,2017-02-15 07:27:13.000000,THE AMAZING ATHEIST LOVES GENOCIDE,TJ made an incredibly lazy video defending genocide. And then I made a vaporwave joke on his face. Now more than ever. Vaporwave: ...,,https://i.ytimg.com/vi/B2AlaxGD8sc/hqdefault.jpg,2019-02-28 14:40:49.668440
1199,h69_WYTdAL8,dyingalive,UC6EMO6Qwkga35xshqA9WQUQ,2017-02-13 20:23:08.000000,Dear White Genocide | The Unsaid Truth,"A video discussing the ongoing 'White Genocide' and the uproar over the trailer for the Netflix series ""Dear White People."" School Sucks Podcast ...",,https://i.ytimg.com/vi/h69_WYTdAL8/hqdefault.jpg,2019-02-28 14:40:49.668440
1200,QaRGVvvVD0c,Fake Revolutions,UCKT6Fim4TJR8YB4csrsBKUQ,2017-02-27 05:48:26.000000,Alex Jones on Black Genocide &amp; White Genocide,Alex Jones saying Black Genocide is bad - White Genocide is good.,,https://i.ytimg.com/vi/QaRGVvvVD0c/hqdefault.jpg,2019-02-28 14:40:49.668440
1201,E5Ab6_Q9bJk,The Ankh Life,UCLVAY3zRrcdnlTIjZiTrjPQ,2017-02-24 00:04:36.000000,Operation: White Genocide,The Extinction Of 'The Tamaho' Caucazoid.,,https://i.ytimg.com/vi/E5Ab6_Q9bJk/hqdefault.jpg,2019-02-28 14:40:49.668440
1202,tXyOTh4Bdj4,Jonathan Jennings,UCwUUIijPzfVdw-i4DzS213g,2017-02-13 13:33:44.000000,White Genocide Podcast: UK Gaystapo,Great Britain today would be Ernst Rohm's wet dream.,,https://i.ytimg.com/vi/tXyOTh4Bdj4/hqdefault.jpg,2019-02-28 14:40:49.668440
1203,wDZrmLqcF2I,CobCeo,UC3VEBhpPV3WdLAI-vxzB_0A,2017-02-08 12:38:36.000000,White Genocide Europe   The Inconvenient Truth 1,This is mirrored from https://youtu.be/s29qrpRfifc.,,https://i.ytimg.com/vi/wDZrmLqcF2I/hqdefault.jpg,2019-02-28 14:40:49.668440
1204,-PWErUX0V44,White & Normal,UC5q1_TYHaQNS6A-YiiZHUng,2017-02-11 11:28:00.000000,White Genocide Conspiracy 2,,,https://i.ytimg.com/vi/-PWErUX0V44/hqdefault.jpg,2019-02-28 14:40:49.668440
1205,OEmrGDJS8T0,Jonathan Jennings,UCwUUIijPzfVdw-i4DzS213g,2017-02-25 14:00:19.000000,White Genocide Podcast: Truth Is Haram,"A new low for the anti-white, racist terrorist group ""Resisting Hate"".",,https://i.ytimg.com/vi/OEmrGDJS8T0/hqdefault.jpg,2019-02-28 14:40:49.668440
1206,QqoxqJVq6Cg,Wayne Mostert,UCBZcPPgboGRTcHAsgFlBN2Q,2017-02-21 14:20:28.000000,White Genocide in South Africa,This is a serious matter and you need to know what is happening in South Africa 2017.,,https://i.ytimg.com/vi/QqoxqJVq6Cg/hqdefault.jpg,2019-02-28 14:40:49.668440
1207,HoYrCBhuswg,Jonathan Jennings,UCwUUIijPzfVdw-i4DzS213g,2017-02-13 13:33:44.000000,White Genocide Podcast: SLAT Autistic Screeching,"Resisting Hate From ""Resisting Hate"".",,https://i.ytimg.com/vi/HoYrCBhuswg/hqdefault.jpg,2019-02-28 14:40:49.668440
1208,sx5-EIqzJOc,Jonathan Jennings,UCwUUIijPzfVdw-i4DzS213g,2017-02-13 13:33:44.000000,White Genocide Podcast: The Left Loves Violence #KillAllAntifa,"Yes, #KillAllAntifa.",,https://i.ytimg.com/vi/sx5-EIqzJOc/hqdefault.jpg,2019-02-28 14:40:49.668440
1209,oKknWatJmOU,gas the skypes,UCgyRJfAtmgnZ99YmCF20tUA,2017-02-04 13:00:42.000000,The Guardian calls for White genocide,who can guess what tribe owns the Guardian?,,https://i.ytimg.com/vi/oKknWatJmOU/hqdefault.jpg,2019-02-28 14:40:49.668440
1210,RpjDZDMeZRc,Wences Acosta,UCVhxbI1DYxTiD7qIUnPgTeg,2017-02-11 08:14:12.000000,Dear White People/#WhiteGenocide Rant,I am a VERY calm person...But some things needed to be said.,,https://i.ytimg.com/vi/RpjDZDMeZRc/hqdefault.jpg,2019-02-28 14:40:49.668440
1211,pYT4i0PPvt0,Jonathan Jennings,UCwUUIijPzfVdw-i4DzS213g,2017-02-20 13:23:57.000000,White Genocide Podcast: Hate Speeches,"Each morning that I awake, I am instantly consumed by all of my swelling HATE, All of this bubbling HATE gives me such great sorrow, It seems it will forever ...",,https://i.ytimg.com/vi/pYT4i0PPvt0/hqdefault.jpg,2019-02-28 14:40:49.668440
1212,QuIXAJy8P_U,Angie E,UC-rjALhnRvejcfSBGOnf5iQ,2017-02-28 19:39:25.000000,Self inflicted white genocide,,,https://i.ytimg.com/vi/QuIXAJy8P_U/hqdefault.jpg,2019-02-28 14:40:49.668440
1213,5awDLklW07U,Life Reviews,UCeCftf8J9GssnXCu5tqzHSQ,2017-02-05 04:10:34.000000,THE &#39;Stop White Genocide&#39; Video,"Is this video a racist propaganda Video, or is there truth to the idea that there exists a double standard regarding the protection of a persons heritage?",,https://i.ytimg.com/vi/5awDLklW07U/hqdefault.jpg,2019-02-28 14:40:49.668440
1214,WxfevTwQTGY,FwdRad.io,UCc2nCEnw0rfBDxB9fXF1BaA,2017-02-28 04:44:47.000000,All professor George Ciccariello-Maher wants for Christmas is white genocide,Source: https://www.spreaker.com/user/fwdrad.io/all-professor-george-ciccariello-maher-w Drexel professor George Ciccariello-Maher caused quite the ...,,https://i.ytimg.com/vi/WxfevTwQTGY/hqdefault.jpg,2019-02-28 14:40:49.668440
1215,b-cR74n8j04,pham luan,UCORaWCGsKGjltqYAx3jiRNA,2017-02-18 22:46:27.000000,COUDENHOVE KALERGI PLAN IN BIBEL AUFGEDECKT White Genocide,,,https://i.ytimg.com/vi/b-cR74n8j04/hqdefault.jpg,2019-02-28 14:40:49.668440
1216,CHk3_Ku4n4c,Cellar Door Skeptics,UCdj8sFkg31DDFCxaUSlb9Jg,2017-02-25 01:02:55.000000,Netflix and White Genocide,Source: https://www.spreaker.com/user/cellardoorskeptics/netflix-and-white-genocide #2:The Attic Window - Netflix and White Genocide This short segment ...,,https://i.ytimg.com/vi/CHk3_Ku4n4c/hqdefault.jpg,2019-02-28 14:40:49.668440
1217,d7PN0KM7Tow,world news,UCTbeXoVuvl-FIQsNltQIBDQ,2017-02-12 08:32:28.000000,"Netflix Promotes WHITE GENOCIDE ! ! no, you&#39;re just an a  hole   News Dump",,,https://i.ytimg.com/vi/d7PN0KM7Tow/hqdefault.jpg,2019-02-28 14:40:49.668440
1218,lxU7Ntnf1bo,Richard Caldwell,UCChpJstQKJPKAHoJKO3f8eA,2017-02-18 21:15:01.000000,What Is White Genocide,,,https://i.ytimg.com/vi/lxU7Ntnf1bo/hqdefault.jpg,2019-02-28 14:40:49.668440
1219,267w2rSnB-Y,Philosophy Tube,UC2PA-AKmVpU6NKCGtZq_rKQ,2017-03-24 19:00:01.000000,White Supremacist Propaganda Vs Truth | Philosophy Tube,"We need to understand how white supremacist propaganda works and what it tells us about communication and truth. Let's look at the myth of the Irish Slaves, ...",,https://i.ytimg.com/vi/267w2rSnB-Y/hqdefault.jpg,2019-02-28 14:40:50.345173
1220,VWO9zVHVfHM,ReyRoSho,UCceuqddArsKcKEXwKfKGU1w,2017-03-23 02:44:18.000000,Protecting White Majority || Jontron&#39;s &quot;Factual Opinions&quot;,"Being offended/'triggered', questioning racism, or even mentioning racism has become the NEW racism... to the extent of people fearing the imaginary ...",,https://i.ytimg.com/vi/VWO9zVHVfHM/hqdefault.jpg,2019-02-28 14:40:50.345173
1221,ndkvgmGIQHQ,Fox News,UCXIJgqnII2ZOINSWNOGFThA,2017-03-31 02:03:45.000000,&#39;White genocide&#39; prof: No place on campus for racist Murray,"Tucker takes on professor who once tweeted, 'All I want for Christmas is white genocide' and argues that 'pseudoscientific racist' Charles Murray doesn't have a ...",,https://i.ytimg.com/vi/ndkvgmGIQHQ/hqdefault.jpg,2019-02-28 14:40:50.345173
1222,CwftJiamb4U,Fact Check,UCW-xtn2S4R3KusZ37rkNDDg,2017-03-25 11:13:49.000000,JonTron VS Destiny - White &quot;Genocide&quot;,Excerpts from the debate with Destiny and JonTron. Here's the video in question: https://youtu.be/6RQA9GZprqM?t=23m21s.,,https://i.ytimg.com/vi/CwftJiamb4U/hqdefault.jpg,2019-02-28 14:40:50.345173
1223,n-QR7s-ZGRY,Wild Smile,UC39wDqrRwtgVtWUPZmbJ0hw,2017-03-31 13:12:15.000000,White Genocide Professor Makes A Fool Out of Himself Again on Twitter and Tucker Carlson Tonight,"The White Genocide Professor from Drexel University, George Ciccariello-Maher, makes a comment on Twitter, again causing people to call him a coward, ...",,https://i.ytimg.com/vi/n-QR7s-ZGRY/hqdefault.jpg,2019-02-28 14:40:50.345173
1224,Os18858XkBo,Matthew North,UC66IBH4uFkBTzEh2olFFJSg,2017-03-11 19:37:53.000000,Who&#39;s Behind The Left Multiculturalism &amp; The Invasion Of The West? Zionist Jews For White Genocide,Why didn't the Europeans oppose these Invaders? First off they were told they would be receiving women and children in much smaller number for Syria.,,https://i.ytimg.com/vi/Os18858XkBo/hqdefault.jpg,2019-02-28 14:40:50.345173
1225,9IYCVNwKB4s,DC Statesman,UCp80KnAH2DG0P2-fzhbhdiA,2017-03-31 12:46:10.000000,Tucker Carlson Demolishes &#39;White Genocide&#39; Professor George Ciccariello Maher,This is the professor that said he almost vomited seeing someone give up their seat for a soldier. He has also called for a white genocide.,,https://i.ytimg.com/vi/9IYCVNwKB4s/hqdefault.jpg,2019-02-28 14:40:50.345173
1226,Ynvadvrx1TA,PressResetEarth,UC9wxjziCxBF5qB241GZSD6Q,2017-03-19 15:43:31.000000,Erdogan Regime Calls for White Genocide &amp; &quot;Holy War&quot; In Europe,Please consider becoming a Patron and contributing to PressResetEarth - https://www.patreon.com/PressResetEarth Sources: ...,,https://i.ytimg.com/vi/Ynvadvrx1TA/hqdefault.jpg,2019-02-28 14:40:50.345173
1227,9OIQdyCDZVw,Adam Adams,UC5QSdZI069By2F0FyJ2SrjQ,2017-03-16 12:37:06.000000,Jews Admit Organising White Genocide,,,https://i.ytimg.com/vi/9OIQdyCDZVw/hqdefault.jpg,2019-02-28 14:40:50.345173
1228,Ve1IlMLmwK0,Volker Egner,UC-4TnvuTdc4I7yGUK6ExDsw,2017-03-11 04:40:00.000000,Jews push for Immigration and White Genocide ?,quote.... Most people still haven't grasped the fact that Jews are the principal exponents of the massive non-white immigration invasion into white countries and ...,,https://i.ytimg.com/vi/Ve1IlMLmwK0/hqdefault.jpg,2019-02-28 14:40:50.345173
1229,uJ8EvB3z7Pk,Conscious Consumer Network,UCiQXRByjTj9gYJqI8O22KBw,2017-03-08 07:10:01.000000,White genocide in South Africa and the woman dedicated to helping her people.,Leigh Oxley Du Preez has made it her life's mission to helping the white people in South Africa who are living as white refugees in their own country.,,https://i.ytimg.com/vi/uJ8EvB3z7Pk/hqdefault.jpg,2019-02-28 14:40:50.345173
1230,X6Gklt--rIU,Dave Slayton,UCPdMObbwCg606m_8xi8dBng,2017-03-28 00:17:35.000000,Multiculturalism &amp; diversitiy = white genocide. ?????????? ???????. ??????????? ???????????????????,,,https://i.ytimg.com/vi/X6Gklt--rIU/hqdefault.jpg,2019-02-28 14:40:50.345173
1231,p1ZpYhpA_fY,Martin Brodel,UCKWkoasaJMtC8bB1vq0AG8Q,2017-03-31 14:05:50.000000,Tucker Shreds &quot;White Genocide&quot; Prof Almost Vomited After 1st Class Pass Gave Up Seat For Soldier,http://www.zerohedge.com/news/2017-03-31/tucker-shreds-white-genocide-professor-who-almost-vomited-after-1st-class-passenger-,,https://i.ytimg.com/vi/p1ZpYhpA_fY/hqdefault.jpg,2019-02-28 14:40:50.345173
1232,-L7fxSaoUmo,Jack Hampton,UCXkNJfMr4dD40MGA72ZWYQg,2017-03-24 13:07:08.000000,"White Genocide, Whale Riding and Pathological Altruism","White people are naturally extremely altruistic but when our enemy exploits our nature with White Guilt, it becomes Pathological Altruism and is used to eliminate ...",,https://i.ytimg.com/vi/-L7fxSaoUmo/hqdefault.jpg,2019-02-28 14:40:50.345173
1233,zapgofFaWn0,Fake Revolutions,UCKT6Fim4TJR8YB4csrsBKUQ,2017-03-17 17:54:13.000000,UK Parliament Home Affairs on Hate Speech &amp; White Genocide,UK Parliament Home Affairs hearing on Hate Speech & White Genocide videos on Youtube.,,https://i.ytimg.com/vi/zapgofFaWn0/hqdefault.jpg,2019-02-28 14:40:50.345173
1234,Qdj_uPDiIkE,Make Sweden Great Again,UC5Yv8D1wQmkVGxd--kL7fxg,2017-03-27 06:22:13.000000,#SwedenSOS White Genocide By Design - The Coudenhove Kalergi Plan,,,https://i.ytimg.com/vi/Qdj_uPDiIkE/hqdefault.jpg,2019-02-28 14:40:50.345173
1235,6LNlwzeOLf4,Jack Burton,UCGUg8tKiuqCM3ZCAy3XdmKA,2017-03-07 10:20:01.000000,Gavin McCuck - If You&#39;re Not for White Genocide You&#39;re a Politically Correct Pussy,"Gavin has said a lot of stupid shit, but this is the most absurd yet. ""If you're against anti-white propaganda movies then you're politically correct."" Apparently ...",,https://i.ytimg.com/vi/6LNlwzeOLf4/hqdefault.jpg,2019-02-28 14:40:50.345173
1236,nolFO3hkBhY,Kruno Baraba,UCK-Vv838Wu4ANcRkvUXQmJQ,2017-03-20 17:14:59.000000,"White Genocide , Apes , Albert Pike , KKK , Islam and Lucifer","BUS ATTACK VIDEO HERE - The copy right anal part https://www.youtube.com/watch?v=D24bK9mqKo4&t=13s White Genocide , Apes , Albert Pike , KKK ...",,https://i.ytimg.com/vi/nolFO3hkBhY/hqdefault.jpg,2019-02-28 14:40:50.345173
1237,zTpVem0cz1M,Maga Films,UCN0LBBCfDgm_FWr-JtIyzQg,2017-03-05 03:21:14.000000,Say No To White Genocide,White people have more diversity than any other race. We do not need to be like everyone else.,,https://i.ytimg.com/vi/zTpVem0cz1M/hqdefault.jpg,2019-02-28 14:40:50.345173
1238,I6joq5rAtAM,NSTruth1488,UCMMsN9xUEWgOSPEXI9W7rlw,2017-03-30 23:42:55.000000,There is no White Genocide,We need to act now and take back our lives. Heil Hitler everybody!,,https://i.ytimg.com/vi/I6joq5rAtAM/hqdefault.jpg,2019-02-28 14:40:50.345173
1239,5c3u1E-xoEY,BLACK TRUTH,UCfAl3wQt9xmm2tmDc8Tq1VQ,2017-03-19 16:30:00.000000,White Genocide: The Video the Media Doesn&#39;t Want You To See!,White Genocide is REAL! And the media is covering it up!,,https://i.ytimg.com/vi/5c3u1E-xoEY/hqdefault.jpg,2019-02-28 14:40:50.345173
