,video_id,channel_title,channel_id,video_publish_date,video_title,video_description,video_category,video_thumbnail,collection_date
585,9R47RqoMMUY,Jack Hampton,UCXkNJfMr4dD40MGA72ZWYQg,2015-03-24 11:13:06.000000,Diversity March 2015 Multiculturalism equals White Genocide,"Africa for the Africans, Asia for the Asians, White countries for everyone? Everybody says there is this RACE problem. Everybody says this RACE problem will be ...",,https://i.ytimg.com/vi/9R47RqoMMUY/hqdefault.jpg,2019-02-28 14:40:33.406568
586,4Nt9Jb9YFrg,NicanTlacaWomenWarriors,UCkH4YXsYg7XLsy1eMrPDovA,2015-03-31 03:44:50.000000,Canonizing Genocide: Junipero Serra Was a Monster of White Supremacy,This is a brief presentation on our take of Pope Francis' decision to canonize Serra this coming September. Follow our campaign on facebook: ...,,https://i.ytimg.com/vi/4Nt9Jb9YFrg/hqdefault.jpg,2019-02-28 14:40:33.406568
587,OcoqXSiPPBM,Minnie Ervia,UColH5tJGUIRSJXGV9jbTqHA,2015-03-26 13:37:32.000000,"White Genocide Aerial Banner over San Francisco - March 21st, 2015","On March 21st, 2015 an aerial banner flew over San Francisco with the hashtag #WhiteGenocide March Against #WhiteGenocide was a worldwide success.",,https://i.ytimg.com/vi/OcoqXSiPPBM/hqdefault.jpg,2019-02-28 14:40:33.406568
588,y70MgW4ne4o,Pete Hutcheon,UC-MKsNN_FbYejyjzCfgqTfw,2015-03-12 20:47:32.000000,The White Genocide Fallacy,"white supremacists just love to quote percentages to prove their theory of white genocide, let's check the raw data to see if there is a decline in NUMBERS of ...",,https://i.ytimg.com/vi/y70MgW4ne4o/hqdefault.jpg,2019-02-28 14:40:33.406568
589,HwvzOUDDmZY,Realist Report,UCmRa1wLk8TYPutAtNXsubyA,2015-03-20 17:27:16.000000,#WhiteGenocide (WhiteRabbitRemix),Get Active. It's a scam. Fight White Genocide. FightWhiteGenocide.com WhiteGenocideProject.com youtube.com/WhiteRabbitRadioTV.,,https://i.ytimg.com/vi/HwvzOUDDmZY/hqdefault.jpg,2019-02-28 14:40:33.406568
590,DeyyjkSvPF8,valkyrieinthesky,UCXyqT68LS7Ra6ygHzBJSiiw,2015-03-21 04:10:31.000000,#WhiteGenocide in a Melting Pot  (Mirror Please),WhiteGenocide in a Melting Pot.,,https://i.ytimg.com/vi/DeyyjkSvPF8/hqdefault.jpg,2019-02-28 14:40:33.406568
591,yTtjjpy_4f4,American Freedom Party,UCg4tN9uJ1PCPN5SbOt6mhrg,2015-03-26 05:20:53.000000,Operation White Storm,WhiteGenocide Diversity = White Genocide.,,https://i.ytimg.com/vi/yTtjjpy_4f4/hqdefault.jpg,2019-02-28 14:40:33.406568
592,2aiCi14Wpro,Jack Hampton,UCXkNJfMr4dD40MGA72ZWYQg,2015-03-20 08:57:24.000000,Malcolm Fraser&#39;s Most Famous Quote - White Genocide,Malcolm Fraser knew what he was doing when he implemented Multiculturalism. Here is the proof!,,https://i.ytimg.com/vi/2aiCi14Wpro/hqdefault.jpg,2019-02-28 14:40:33.406568
593,mmqEEz_g3FE,Mein Volk,UClFOcD-03srVDGTBqyjC1jQ,2015-03-18 00:39:20.000000,#whitegenocide,"Why does forced immigration, forced integration and forced diversity only happen in White countries?",,https://i.ytimg.com/vi/mmqEEz_g3FE/hqdefault.jpg,2019-02-28 14:40:33.407566
594,nu4fJntKgBA,Jack Hampton,UCXkNJfMr4dD40MGA72ZWYQg,2015-03-30 14:04:10.000000,"Australia GST raised again, White Genocide ignored Typical!",You work 2.5 days out of 5 for the Government. WOW So much TAX! And the Anti-White government wants to increase the TAX WTF! So you work 3 days out of 5 ...,,https://i.ytimg.com/vi/nu4fJntKgBA/hqdefault.jpg,2019-02-28 14:40:33.407566
595,I8cp8FYr7e4,Jack Hampton,UCXkNJfMr4dD40MGA72ZWYQg,2015-03-20 10:36:33.000000,Malcolm Fraser&#39;s Death and White Genocide Explained,Malcolm Fraser knew what he was doing when he implimented Multicultrualism. Here is the proof!,,https://i.ytimg.com/vi/I8cp8FYr7e4/hqdefault.jpg,2019-02-28 14:40:33.407566
596,VWDt5VlrYoM,Jack Hampton,UCXkNJfMr4dD40MGA72ZWYQg,2015-03-10 11:50:35.000000,QANDA Would Julie Bishop go TOPLESS to Stop White Genocide!,Very funny. Would Bishop go TOPLESS to save the Bali 9 drug smugglers. Why not ask her if she would go topless to stop White Genocide!,,https://i.ytimg.com/vi/VWDt5VlrYoM/hqdefault.jpg,2019-02-28 14:40:33.407566
597,CHPow38oJR8,eyeslevel,UC00751cgsU5hR8VhCn18V0g,2015-03-30 00:59:19.000000,Paltalk Fight White Genocide 2015 03 28,,,https://i.ytimg.com/vi/CHPow38oJR8/hqdefault.jpg,2019-02-28 14:40:33.407566
598,rVVqGUXHppU,eyeslevel,UC00751cgsU5hR8VhCn18V0g,2015-03-09 19:05:43.000000,Paltalk Fight White Genocide 3 7 15,,,https://i.ytimg.com/vi/rVVqGUXHppU/hqdefault.jpg,2019-02-28 14:40:33.407566
599,dM8ssU8YQgo,eyeslevel,UC00751cgsU5hR8VhCn18V0g,2015-03-17 04:16:45.000000,Paltalk Fight White Genocide 3 14 15,,,https://i.ytimg.com/vi/dM8ssU8YQgo/hqdefault.jpg,2019-02-28 14:40:33.407566
600,-JfMpD5CbQk,eyeslevel,UC00751cgsU5hR8VhCn18V0g,2015-03-23 14:02:57.000000,Paltalk Fight White Genocide 2015 03 21,,,https://i.ytimg.com/vi/-JfMpD5CbQk/hqdefault.jpg,2019-02-28 14:40:33.407566
601,gcgzmDoXlIQ,Jack Hampton,UCXkNJfMr4dD40MGA72ZWYQg,2015-03-10 10:55:51.000000,Q&amp;A Would Bishop go TOPLESS to save the Bali 9. White Genocide,Is Feminism just Anti-Whitism. Would Bishop go topless to save the condemned Bali 9. Is Multiculturalism just a code word for White Genocide. Are feminists ...,,https://i.ytimg.com/vi/gcgzmDoXlIQ/hqdefault.jpg,2019-02-28 14:40:33.407566
602,hru5uQLu-10,Jack Hampton,UCXkNJfMr4dD40MGA72ZWYQg,2015-03-05 13:30:39.000000,"Guy has Seizure while Skydiving, White Genocide",Guy has Seizure while Skydiving and hears the White Genocide Mantra song.,,https://i.ytimg.com/vi/hru5uQLu-10/hqdefault.jpg,2019-02-28 14:40:33.407566
603,T4D94WBJ-rQ,Erwin Rommel,UCYUs8DMfWrJVCsbVo2RzM7g,2015-03-21 15:55:38.000000,Anti-Racist is Codeword for Anti-White #LoveYourWhitePeople,Song: Anti-whites Up All Night Justifying White Genocide.,,https://i.ytimg.com/vi/T4D94WBJ-rQ/hqdefault.jpg,2019-02-28 14:40:33.407566
604,FnM-Uy6P_iw,Jack Hampton,UCXkNJfMr4dD40MGA72ZWYQg,2015-03-20 09:56:51.000000,Malcolm Fraser&#39;s most used Quote for fighting White Genocide,Malcolm Fraser knew what he was doing when he implimented Multicultrualism. Here is the proof!,,https://i.ytimg.com/vi/FnM-Uy6P_iw/hqdefault.jpg,2019-02-28 14:40:33.407566
605,z7pBceSOUUw,eyeslevel,UC00751cgsU5hR8VhCn18V0g,2015-03-02 03:20:42.000000,Paltalk Fight White Genocide 2 28 15,,,https://i.ytimg.com/vi/z7pBceSOUUw/hqdefault.jpg,2019-02-28 14:40:33.407566
606,HBLxip3iHMk,Steve Shives,UCD4qMoFPUEzSn4CurFLJkIQ,2015-04-01 12:00:00.000000,Five Stupid Things About White Genocide,"What about white people? Won't someone speak up for our problems? Pretty soon, we'll all be gone. And then you'll be sorry! . . . Don't forget to hit the ...",,https://i.ytimg.com/vi/HBLxip3iHMk/hqdefault.jpg,2019-02-28 14:40:34.020213
607,_uQQy9I3qIA,Elfanu Nils,UC__UisE7AECciPyqXV6ToKw,2015-04-05 01:57:42.000000,Stop White Genocide Activism at Hillcrest Mall.,I am doing activism for promoting pro-white awareness and the genocide occurring specifically in Europe and South Africa.,,https://i.ytimg.com/vi/_uQQy9I3qIA/hqdefault.jpg,2019-02-28 14:40:34.020213
608,u6DSVgK8d_c,Robin Brant,UCu7b6aV9TqIarqGR5dsjcrw,2015-04-13 19:46:05.000000,ukip supporter jan on &#39;genocide&#39; of white british people,personal views of ukip supporter i interviewed at farage speech.,,https://i.ytimg.com/vi/u6DSVgK8d_c/hqdefault.jpg,2019-02-28 14:40:34.020213
609,tcgNTi9B6lo,Jack Hampton,UCXkNJfMr4dD40MGA72ZWYQg,2015-04-25 12:58:20.000000,Real Australians Say Stop White Genocide,Real Australians have always rejected mass 3rd world migration. Australians don't want White Genocide but the people who call them-selves 'Anti-Racists' are ...,,https://i.ytimg.com/vi/tcgNTi9B6lo/hqdefault.jpg,2019-02-28 14:40:34.020213
610,3aza6OW5AJM,CBS 42,UCeR4TlbmojlqImgr-2SBkJQ,2015-04-03 23:36:44.000000,White genocide sign sparks controversy,White genocide sign sparks controversy.,,https://i.ytimg.com/vi/3aza6OW5AJM/hqdefault.jpg,2019-02-28 14:40:34.020213
611,kSzMARypfH4,Jack Hampton,UCXkNJfMr4dD40MGA72ZWYQg,2015-04-07 13:47:34.000000,Asian Man Fights White Genocide in shopping center,"Asian man rallies against White Genocide. What have you don't to stop White Genocide! ASIA FOR THE ASIANS, AFRICA FOR THE AFRICANS, WHITE ...",,https://i.ytimg.com/vi/kSzMARypfH4/hqdefault.jpg,2019-02-28 14:40:34.020213
612,64umaENiFko,Jack Hampton,UCXkNJfMr4dD40MGA72ZWYQg,2015-04-03 13:26:51.000000,ABC Polar Bear Conversations about White Genocide Hybridization Ice caps melting,"ASIA FOR THE ASIANS, AFRICA FOR THE AFRICANS, WHITE COUNTRIES FOR EVERYBODY! Everybody says there is this RACE problem. Everybody says ...",,https://i.ytimg.com/vi/64umaENiFko/hqdefault.jpg,2019-02-28 14:40:34.020213
613,t6OBSLbKVMc,Jack Hampton,UCXkNJfMr4dD40MGA72ZWYQg,2015-04-30 14:53:34.000000,UKIP Stops immigration and attacks Anti-Whites,Wonderful speech from the UKIP agaist white genocide and lays into Anti-White Belguem Greens hypocrite.,,https://i.ytimg.com/vi/t6OBSLbKVMc/hqdefault.jpg,2019-02-28 14:40:34.020213
614,_dirPTFPdTE,WLOS News 13,UCu0Gn50PSjozOgwgPVTBB4A,2015-04-17 18:33:42.000000,#WhiteGenocide Signs Pop Up In Asheville,"ASHEVILLE, N.C. -- A controversial sign spotted in other states has now appeared in Asheville. The sign references diversity with the hashtag ""white genocide.",,https://i.ytimg.com/vi/_dirPTFPdTE/hqdefault.jpg,2019-02-28 14:40:34.020213
615,3IXfPRvKg_g,Emira 굘뚈?,UC7p0voJQZtF3iGm5kxk8Sdw,2015-04-06 14:35:09.000000,Asian guy opposes White Genocide,,,https://i.ytimg.com/vi/3IXfPRvKg_g/hqdefault.jpg,2019-02-28 14:40:34.020213
616,CtxTidYoCAA,Jack Hampton,UCXkNJfMr4dD40MGA72ZWYQg,2015-04-24 23:27:46.000000,ANZAC Day Australia 2015 and Asian man fights White Genocide,"ANZAC Day Australia 2015 and Asian Man protests against White Genocide. The Mantra ASIA FOR THE ASIANS, AFRICA FOR THE AFRICANS, WHITE ...",,https://i.ytimg.com/vi/CtxTidYoCAA/hqdefault.jpg,2019-02-28 14:40:34.020213
617,XnOCco3arXs,Jack Hampton,UCXkNJfMr4dD40MGA72ZWYQg,2015-04-16 11:49:36.000000,UKIP Fights White Genocide,"UKIP supporters swing the party to wake up English about the International program of White Genocide. The Mantra ASIA FOR THE ASIANS, AFRICA FOR THE ...",,https://i.ytimg.com/vi/XnOCco3arXs/hqdefault.jpg,2019-02-28 14:40:34.020213
618,MWEjpJMsBTc,Jack Hampton,UCXkNJfMr4dD40MGA72ZWYQg,2015-04-25 12:11:31.000000,Real Australians Say Welcome to Stop White Genocide,"Most Australians don't want White Genocide. The Mantra ASIA FOR THE ASIANS, AFRICA FOR THE AFRICANS, WHITE COUNTRIES FOR EVERYBODY!",,https://i.ytimg.com/vi/MWEjpJMsBTc/hqdefault.jpg,2019-02-28 14:40:34.020213
619,QvHhWZQnnQ4,Steven Watermeyer,UC1EadPk7uWJzAtwQCrrWZFA,2015-04-09 07:37:19.000000,South Africa - Genocide - Our Dying Country !,White genocide in South Africa -,,https://i.ytimg.com/vi/QvHhWZQnnQ4/hqdefault.jpg,2019-02-28 14:40:34.020213
620,RPoCUkzOc6M,Europid Solidarity,UCnPbfsOGKSxLeYUScziQRmw,2015-04-05 19:56:07.000000,"White Man March / March Against #WhiteGenocide in Christchurch, NZ",I found this online and wanted to upload it to youtube. I had no connection to this particular demonstration. White Man March / March Against #WhiteGenocide: ...,,https://i.ytimg.com/vi/RPoCUkzOc6M/hqdefault.jpg,2019-02-28 14:40:34.020213
621,kfmJYW-Ax6c,Dr Chad Sawyer,UCycUlR6CcE-seF9w5oXbnog,2015-04-23 03:11:20.000000,Stop White Genocide,,,https://i.ytimg.com/vi/kfmJYW-Ax6c/hqdefault.jpg,2019-02-28 14:40:34.020213
622,bu8dG9GTIV0,Dr Chad Sawyer,UCycUlR6CcE-seF9w5oXbnog,2015-04-23 03:59:34.000000,THE Stop White Genocide Video,,,https://i.ytimg.com/vi/bu8dG9GTIV0/hqdefault.jpg,2019-02-28 14:40:34.020213
623,qYgoGX4sdAM,eyeslevel,UC00751cgsU5hR8VhCn18V0g,2015-04-13 06:02:22.000000,Paltalk Fight White Genocide 2015 04 11,,,https://i.ytimg.com/vi/qYgoGX4sdAM/hqdefault.jpg,2019-02-28 14:40:34.021211
624,IqT3mBfOPyo,whatisit,UCZjCbYt8aniHm7qOlUabwuQ,2015-04-03 06:26:53.000000,#WhiteGenocide content for video makers - free to use,WhiteGenocide content for video makers - free to use.,,https://i.ytimg.com/vi/IqT3mBfOPyo/hqdefault.jpg,2019-02-28 14:40:34.021211
625,5VVYq66_PXQ,Dead Grand mammy tukidream,UCH7PzwaQ8OK97neut-eehoQ,2015-04-07 19:55:22.000000,Anti Whites Up All Night justifying White Genocide,,,https://i.ytimg.com/vi/5VVYq66_PXQ/hqdefault.jpg,2019-02-28 14:40:34.021211
626,8aYHHlb7MZo,Jack Hampton,UCXkNJfMr4dD40MGA72ZWYQg,2015-04-03 06:15:04.000000,ABC Radio Polar Bears and White Genocide,"We are losing the Polar Bears and Human Diversity! The Mantra ASIA FOR THE ASIANS, AFRICA FOR THE AFRICANS, WHITE COUNTRIES FOR ...",,https://i.ytimg.com/vi/8aYHHlb7MZo/hqdefault.jpg,2019-02-28 14:40:34.021211
627,wKLH-bJ1pBw,Dr Chad Sawyer,UCycUlR6CcE-seF9w5oXbnog,2015-04-23 04:17:37.000000,white genocide warning,,,https://i.ytimg.com/vi/wKLH-bJ1pBw/hqdefault.jpg,2019-02-28 14:40:34.021211
628,p_3urMthz_U,Dead Grand mammy tukidream,UCH7PzwaQ8OK97neut-eehoQ,2015-04-07 19:48:16.000000,The Endgame   Full White Genocide documentary,,,https://i.ytimg.com/vi/p_3urMthz_U/hqdefault.jpg,2019-02-28 14:40:34.021211
629,Tc3PBAwDQZA,Dr Chad Sawyer,UCycUlR6CcE-seF9w5oXbnog,2015-04-23 04:15:58.000000,White Genocide Mantra On Spanish National TV,,,https://i.ytimg.com/vi/Tc3PBAwDQZA/hqdefault.jpg,2019-02-28 14:40:34.021211
630,g_lxW8zRrLU,Dr Chad Sawyer,UCycUlR6CcE-seF9w5oXbnog,2015-04-23 04:15:12.000000,Future Generation  Our answer to SDU White Genocide Edition,,,https://i.ytimg.com/vi/g_lxW8zRrLU/hqdefault.jpg,2019-02-28 14:40:34.021211
631,rLi4wohTAJk,camdengreen,UCZGLfnNL5j-1DI3OABNs6nw,2015-05-05 21:36:06.000000,South Africa: violence against Whites -- April 2015,"Sorry about the barcode. I used a ""free"" file conversion program without realizing that if you don't buy it, it leaves a barcode on your video! This video was ...",,https://i.ytimg.com/vi/rLi4wohTAJk/hqdefault.jpg,2019-02-28 14:40:34.782220
632,atE7dcvdLcE,108morris108,UCweyNwo4cZM5gsIpuG4Zlew,2015-05-30 10:10:07.000000,"Syria, ISIS, Saudia Arabia Unstable, Blood Bonds, White Genocide,  truther network - Morris",We are programmed and planned everything about us is unoriginal.,,https://i.ytimg.com/vi/atE7dcvdLcE/hqdefault.jpg,2019-02-28 14:40:34.782220
633,rgmiU5AiAfQ,NaturalNobility,UCq3Lk88H3GUAniw4HHE4Zcw,2015-05-26 17:30:18.000000,Alex on the Death of the White Race,The Zionist Jews have planned the genocide of the White Race since hundreds if not thousands of years. They want us gone. The Third Reich was a rebellion ...,,https://i.ytimg.com/vi/rgmiU5AiAfQ/hqdefault.jpg,2019-02-28 14:40:34.782220
634,Aj7FE3dcxOM,Dr Chad Sawyer,UCycUlR6CcE-seF9w5oXbnog,2015-05-31 19:33:34.000000,Is White Genocide Real,,,https://i.ytimg.com/vi/Aj7FE3dcxOM/hqdefault.jpg,2019-02-28 14:40:34.782220
635,CVpnBIDQmJg,Jack Hampton,UCXkNJfMr4dD40MGA72ZWYQg,2015-05-27 14:11:07.000000,British National Anthem &#39;God Save the Anti-White Queen&#39;,Anti-Whites up all night justifying White Genocide.,,https://i.ytimg.com/vi/CVpnBIDQmJg/hqdefault.jpg,2019-02-28 14:40:34.782220
636,M9Q3T0TtskM,Dr Chad Sawyer,UCycUlR6CcE-seF9w5oXbnog,2015-05-31 21:37:53.000000,"Muhammad Ali   Pro White, Against White Genocide",,,https://i.ytimg.com/vi/M9Q3T0TtskM/hqdefault.jpg,2019-02-28 14:40:34.782220
637,wU5ULbUc1W4,Dr Chad Sawyer,UCycUlR6CcE-seF9w5oXbnog,2015-05-31 19:54:50.000000,White Genocide Is Real,,,https://i.ytimg.com/vi/wU5ULbUc1W4/hqdefault.jpg,2019-02-28 14:40:34.782220
638,maaXDGNG65s,Jack Hampton,UCXkNJfMr4dD40MGA72ZWYQg,2015-05-04 14:15:55.000000,White Genocide Movie Continued,White Genocide in London.,,https://i.ytimg.com/vi/maaXDGNG65s/hqdefault.jpg,2019-02-28 14:40:34.782220
639,I04n6Z-9vxs,RESTRUKT-media,UCUzOv2pfVmo9swFEQeERgCA,2015-05-20 23:41:12.000000,?? ??????????! #WhiteGenocide ???  ????????,????? ??? ????? ?? ????????? ????????? ? ??? ??? ?????????? ?????????? ?????? ? ??????? ????? ??????. ??...,,https://i.ytimg.com/vi/I04n6Z-9vxs/hqdefault.jpg,2019-02-28 14:40:34.782220
640,_BcuHO_8Ubw,Dr Chad Sawyer,UCycUlR6CcE-seF9w5oXbnog,2015-05-31 19:37:53.000000,Stop White Genocide   White Rabbit Radio,,,https://i.ytimg.com/vi/_BcuHO_8Ubw/hqdefault.jpg,2019-02-28 14:40:34.782220
641,e-snBbpZ4ts,Dr Chad Sawyer,UCycUlR6CcE-seF9w5oXbnog,2015-05-31 03:47:01.000000,This is Europa   Say NO to White Genocide,,,https://i.ytimg.com/vi/e-snBbpZ4ts/hqdefault.jpg,2019-02-28 14:40:34.783218
642,-HcQuRV4cfc,thule7700,UC3-l73WNYv2nuIZ2Ah6IdCQ,2015-05-17 11:32:44.000000,Genocide of White South Africa with Deirdre Fields and KAS 1 of 4,,,https://i.ytimg.com/vi/-HcQuRV4cfc/hqdefault.jpg,2019-02-28 14:40:34.783218
643,zkJFsQpWeB4,Dr Chad Sawyer,UCycUlR6CcE-seF9w5oXbnog,2015-05-31 21:39:14.000000,Miscegenation is NWO plan for White Genocide,,,https://i.ytimg.com/vi/zkJFsQpWeB4/hqdefault.jpg,2019-02-28 14:40:34.783218
644,jC60AdmFMDs,Dr Chad Sawyer,UCycUlR6CcE-seF9w5oXbnog,2015-05-31 23:38:44.000000,British Say NO to White Genocide,,,https://i.ytimg.com/vi/jC60AdmFMDs/hqdefault.jpg,2019-02-28 14:40:34.783218
645,ma6C6OR_4fY,Politisk Ukorrekt,UCdC8ZKWKua98BcLlXYPHCFQ,2015-05-11 03:10:55.000000,The Ongoing White Genocide!,,,https://i.ytimg.com/vi/ma6C6OR_4fY/hqdefault.jpg,2019-02-28 14:40:34.783218
646,m0Wm-6WFSfI,thule7700,UC3-l73WNYv2nuIZ2Ah6IdCQ,2015-05-17 11:32:44.000000,Genocide of White South Africa with Deirdre Fields and KAS 4 of 4,,,https://i.ytimg.com/vi/m0Wm-6WFSfI/hqdefault.jpg,2019-02-28 14:40:34.783218
647,vLFw5T_PByM,Dr Chad Sawyer,UCycUlR6CcE-seF9w5oXbnog,2015-05-31 21:53:29.000000,STOP White Genocide,,,https://i.ytimg.com/vi/vLFw5T_PByM/hqdefault.jpg,2019-02-28 14:40:34.783218
648,QwrA6Z0Aq0w,thule7700,UC3-l73WNYv2nuIZ2Ah6IdCQ,2015-05-17 11:32:44.000000,Genocide of White South Africa with Deirdre Fields and KAS 3 of 4,,,https://i.ytimg.com/vi/QwrA6Z0Aq0w/hqdefault.jpg,2019-02-28 14:40:34.783218
649,bx0jTNCX4Fc,thule7700,UC3-l73WNYv2nuIZ2Ah6IdCQ,2015-05-17 11:32:44.000000,Genocide of White South Africa with Deirdre Fields and KAS 2 of 4,,,https://i.ytimg.com/vi/bx0jTNCX4Fc/hqdefault.jpg,2019-02-28 14:40:34.783218
650,czYd0yC3_YY,Politisk Ukorrekt,UCdC8ZKWKua98BcLlXYPHCFQ,2015-05-11 02:52:35.000000,White Genocide in motion,,,https://i.ytimg.com/vi/czYd0yC3_YY/hqdefault.jpg,2019-02-28 14:40:34.783218
651,h9TXCA7XFwA,Dr Chad Sawyer,UCycUlR6CcE-seF9w5oXbnog,2015-05-31 21:48:40.000000,"Stop White Genocide, Knoxville TN   March 15 2014",,,https://i.ytimg.com/vi/h9TXCA7XFwA/hqdefault.jpg,2019-02-28 14:40:34.783218
652,_Jw74a85WF4,Dr Chad Sawyer,UCycUlR6CcE-seF9w5oXbnog,2015-05-31 21:49:43.000000,STOP White geNOcide  2,,,https://i.ytimg.com/vi/_Jw74a85WF4/hqdefault.jpg,2019-02-28 14:40:34.783218
653,rq10YSvs8OE,Dr Chad Sawyer,UCycUlR6CcE-seF9w5oXbnog,2015-05-31 23:38:44.000000,California School Embraces White Genocide,,,https://i.ytimg.com/vi/rq10YSvs8OE/hqdefault.jpg,2019-02-28 14:40:34.783218
654,zOafyO9fcZM,Dr Chad Sawyer,UCycUlR6CcE-seF9w5oXbnog,2015-05-31 23:38:44.000000,"Civil War Really White Genocide, Modern Family is Anti Family   Anti White",,,https://i.ytimg.com/vi/zOafyO9fcZM/hqdefault.jpg,2019-02-28 14:40:34.783218
655,ST7UWqFK7l8,Chris Fitzhugh,UCP-zHdEwdNYLZzKn5fBlLxw,2015-05-26 22:18:24.000000,New Surgery Date and &quot;White Genocide&quot;?,,,https://i.ytimg.com/vi/ST7UWqFK7l8/hqdefault.jpg,2019-02-28 14:40:34.783218
656,Cdn9_KLlyvs,Dr Chad Sawyer,UCycUlR6CcE-seF9w5oXbnog,2015-05-31 21:19:01.000000,Google White Genocide,,,https://i.ytimg.com/vi/Cdn9_KLlyvs/hqdefault.jpg,2019-02-28 14:40:34.783218
657,3bz1gOE_CpM,Dr Chad Sawyer,UCycUlR6CcE-seF9w5oXbnog,2015-05-31 23:42:14.000000,Feminists Laughing at White Genocide,,,https://i.ytimg.com/vi/3bz1gOE_CpM/hqdefault.jpg,2019-02-28 14:40:34.783218
658,m7SdMDr5OJY,Dr Chad Sawyer,UCycUlR6CcE-seF9w5oXbnog,2015-05-31 22:22:00.000000,United Against White Genocide and Anti Whites,,,https://i.ytimg.com/vi/m7SdMDr5OJY/hqdefault.jpg,2019-02-28 14:40:34.783218
659,5lOYf14_os4,Dr Chad Sawyer,UCycUlR6CcE-seF9w5oXbnog,2015-05-31 21:51:25.000000,Piping Up About White Genocide,,,https://i.ytimg.com/vi/5lOYf14_os4/hqdefault.jpg,2019-02-28 14:40:34.783218
660,PaqKfrRRuXI,Dr Chad Sawyer,UCycUlR6CcE-seF9w5oXbnog,2015-05-31 03:24:50.000000,ALERT  STOP WHITE GENOCIDE,,,https://i.ytimg.com/vi/PaqKfrRRuXI/hqdefault.jpg,2019-02-28 14:40:34.783218
661,IKxYrHehMC8,Dr Chad Sawyer,UCycUlR6CcE-seF9w5oXbnog,2015-05-31 23:39:54.000000,EU Rules for More White Genocide,,,https://i.ytimg.com/vi/IKxYrHehMC8/hqdefault.jpg,2019-02-28 14:40:34.783218
662,-LvpXv3Nh3Q,Dr Chad Sawyer,UCycUlR6CcE-seF9w5oXbnog,2015-05-31 03:29:00.000000,Anti Whites Up All Night justifying White Genocide,,,https://i.ytimg.com/vi/-LvpXv3Nh3Q/hqdefault.jpg,2019-02-28 14:40:34.783218
663,ml6qlHmW4qc,Dr Chad Sawyer,UCycUlR6CcE-seF9w5oXbnog,2015-05-31 19:49:45.000000,White Genocide Solution,,,https://i.ytimg.com/vi/ml6qlHmW4qc/hqdefault.jpg,2019-02-28 14:40:34.783218
664,OG-BI41PUeI,Dr Chad Sawyer,UCycUlR6CcE-seF9w5oXbnog,2015-05-31 22:26:08.000000,WHITE GENOCIDE,,,https://i.ytimg.com/vi/OG-BI41PUeI/hqdefault.jpg,2019-02-28 14:40:34.784215
665,x4laDWkQTYg,Dr Chad Sawyer,UCycUlR6CcE-seF9w5oXbnog,2015-05-31 20:11:18.000000,Are You Pro White or Pro White Genocide,,,https://i.ytimg.com/vi/x4laDWkQTYg/hqdefault.jpg,2019-02-28 14:40:34.784215
666,USzyIkuejfw,Dr Chad Sawyer,UCycUlR6CcE-seF9w5oXbnog,2015-05-31 22:35:26.000000,"White Man March, Diversity = White Genocide",,,https://i.ytimg.com/vi/USzyIkuejfw/hqdefault.jpg,2019-02-28 14:40:34.784215
667,eq-kmW-KPQE,Dr Chad Sawyer,UCycUlR6CcE-seF9w5oXbnog,2015-05-31 22:25:38.000000,White Genocide Across The Globe The Mantra,,,https://i.ytimg.com/vi/eq-kmW-KPQE/hqdefault.jpg,2019-02-28 14:40:34.784215
668,BDfddDBBYhU,Dr Chad Sawyer,UCycUlR6CcE-seF9w5oXbnog,2015-05-31 22:26:18.000000,White Genocide 2,,,https://i.ytimg.com/vi/BDfddDBBYhU/hqdefault.jpg,2019-02-28 14:40:34.784215
669,aV9Ed0YFxgA,Dr Chad Sawyer,UCycUlR6CcE-seF9w5oXbnog,2015-05-31 22:28:43.000000,White Man March vs White Genocide,,,https://i.ytimg.com/vi/aV9Ed0YFxgA/hqdefault.jpg,2019-02-28 14:40:34.784215
670,SSC5HHLJU4U,Dr Chad Sawyer,UCycUlR6CcE-seF9w5oXbnog,2015-05-31 03:31:10.000000,White Genocide,,,https://i.ytimg.com/vi/SSC5HHLJU4U/hqdefault.jpg,2019-02-28 14:40:34.784215
671,9NX4fVg0D1U,Aaron Kasparov [24],UCcDOqahmai9OHDs7BETLuCQ,2015-06-22 00:55:33.000000,Jewish Subversion of Whites and America - counter-currents.com,White Genocide: Too Strong A Term?: https://www.youtube.com/watch?v=FrVPiaoBF1w The New Original Sin: https://www.youtube.com/watch?v=9qk9R3u0r00 ...,,https://i.ytimg.com/vi/9NX4fVg0D1U/hqdefault.jpg,2019-02-28 14:40:35.496893
672,OMnCYgOHmpk,Red Ice TV,UCFUC7NaTxZanB_FVOJN92eg,2015-06-09 22:36:19.000000,Greg Johnson - Exploiting Trust-Based Societies &amp; Architects of White Genocide - Hour 1,"Dr. Greg Johnson is the editor-in-Chief of Counter Currents and its journal and webzine North American New Right. He is the author of ""Confessions of a ...",,https://i.ytimg.com/vi/OMnCYgOHmpk/hqdefault.jpg,2019-02-28 14:40:35.496893
673,s70KU0EDL3w,Dr Chad Sawyer,UCycUlR6CcE-seF9w5oXbnog,2015-06-01 03:30:00.000000,White Genocide in London Complete,,,https://i.ytimg.com/vi/s70KU0EDL3w/hqdefault.jpg,2019-02-28 14:40:35.496893
674,89L_enkk67o,David Pakman Show,UCvixJtaXuNdMPUGdOPcY8Ag,2015-06-24 20:30:00.000000,&#39;White Nationalist&#39; Says It&#39;s &#39;Cultural Genocide&#39; Against Whites to Remove Confederate Flag,"Pat Hines, a self-proclaimed white nationalist, tells CNN's Don Lemon that removal of the Confederate flag is 늒ultural genocide ...",,https://i.ytimg.com/vi/89L_enkk67o/hqdefault.jpg,2019-02-28 14:40:35.496893
675,KXAZ8Wwala4,Jack Hampton,UCXkNJfMr4dD40MGA72ZWYQg,2015-06-04 12:18:13.000000,Adam Goodes Dance Vs Muhammad Ali with BBC Anti-White,Adam Goodes dances and Muhammed attackes the Anti-White BBC for wanting to blend black and white people together in ALL and ONLY white countries .,,https://i.ytimg.com/vi/KXAZ8Wwala4/hqdefault.jpg,2019-02-28 14:40:35.496893
676,R-aQibpcF88,HANNES ZAF777,UCqEuMCdUyI2LfNQDIxrsmUA,2015-06-23 14:16:10.000000,WHITE GENOCIDE: SOUTH-AFRICA (Part 4) - BLANKE VOLKSMOORD: SUID-AFRIKA (Deel 4),The endless campaign of hatred directed towards the Whites in South-African. Please feel free to download and reupload these videos to your own YouTube ...,,https://i.ytimg.com/vi/R-aQibpcF88/hqdefault.jpg,2019-02-28 14:40:35.496893
677,Vyss7R2PYE0,VisionLiberty,UC_D1mVegcJk9bIrXIgweJug,2015-06-24 01:30:24.000000,"South Africa Facing White Genocide, Total Communist Takeover",http://www.thenewamerican.com/world-news/africa/item/12326-south-africa-facing-white-genocide-total-communist-takeover While most of the world refuses to ...,,https://i.ytimg.com/vi/Vyss7R2PYE0/hqdefault.jpg,2019-02-28 14:40:35.496893
678,4IwrKyKNcVA,"my pp small , i was cucked and",UC19GFQPYiiwOMVcup8bu-wA,2015-06-25 09:20:08.000000,Literal Cold Hard Proof White Genocide Is Real ! (Why I Support Slavery),"Take that ""Rationalists"" With Your So Called Logic! The Chemtrails Were Programmed By Martin Luther King To Exterminate Those Harmless Defenseless ...",,https://i.ytimg.com/vi/4IwrKyKNcVA/hqdefault.jpg,2019-02-28 14:40:35.496893
679,VseE6J0gve8,Dr Chad Sawyer,UCycUlR6CcE-seF9w5oXbnog,2015-06-01 01:43:34.000000,Stephen Hawking on White Genocide,,,https://i.ytimg.com/vi/VseE6J0gve8/hqdefault.jpg,2019-02-28 14:40:35.496893
680,CFW7jehKwOU,Europa Rising,UCx9nAUsyrQlQYmfwo4-Mq4w,2015-06-18 18:54:10.000000,Eric Zemmour and White Genocide,"A few weeks ago, there was a press conference of a very famous and popular journalist/political analyst in France, called Eric Zemmour. After he was done with ...",,https://i.ytimg.com/vi/CFW7jehKwOU/hqdefault.jpg,2019-02-28 14:40:35.496893
681,UrxYHEYZP_g,"my pp small , i was cucked and",UC19GFQPYiiwOMVcup8bu-wA,2015-06-25 19:53:56.000000,Funniest White Genocide ON TAPE (Feat. John Galt),You uploaded a wide-screen (16:9) video. If your original was 720p or greater (i.e. 1280x720 or greater) we encourage you to submit your video at original ...,,https://i.ytimg.com/vi/UrxYHEYZP_g/hqdefault.jpg,2019-02-28 14:40:35.496893
